id,cim,reszletes_cim,teljes_ar,reszletes_ar,terulet,nm_ar,szobak,epitesi_ev,szint,allapot,ingatlan_allapota,futes,erkely,parkolas,energetikai,tajolas,kert,hirdeto_tipus,leiras,ingatlanos,telefon,link
64,,,,,,,,2001 és 2010 között,3,,jó állapotú,"gázkazán, hűtő-fűtő klíma, kályha",,önálló garázs - benne van az árban,A+,,,ingatlaniroda,"Mielőtt tovább olvas kérem tekintse meg az ingatlanhoz tartozó virtuális túrát és videót! Eladó Érd egyik közkedvelt részén Érdligeten egy bruttó 250 nm-es 3 szintes 4+2 félszobás családi ház. Az összközműves 1205 nm-es telken két családi ház is található használati megosztással elszeparálva, ami a jogutódokra is kihat ezáltal a bankok teljes mértékben meghitelezik a vásárlást. A térképvázlaton eladó házként jelölt A+ -os energetikai besorolású ingatlan 2004-ben épült 38 cm vastag porotherm téglából. A szintek között betonfödém található. A 3 rétegű műanyag nyílászárók, hang és hőszigetelő hatásúak, az alsó szinten redőnnyel és szúnyoghálóval vannak ellátva. Köszönhetően a zsindelytetőre újonnan felszerelt napelemeknek az áram felhasználás költsége nullázódott és még 10 évig szaldós elszámolás érvényes rá. A használati melegvizet és a fűtést a vadonatúj kombi kazán biztosítja, de minden szobában található egy inverteres hűtő-fűtő klíma, illetve harmadlagos fűtésként mindkét szinten elh...",,,https://ingatlan.com/34504961
65,,,,,,,,2025,3,,,"hőszivattyú, padlófűtés",,teremgarázs hely - benne van az árban,,,,ingatlaniroda,"Hivatkozzon erre, kód: 4933 HATALMAS ÁRZUHANÁS! MOST -20 MILLIÓVAL OLCSÓBBAN, 259mFt HELYETT 239mFt! PANORÁMÁS, LUXUS MINIMÁL HÁZ! - ÚJ ÉPÍTÉS - MAGAS MŰSZAKI TARTALOM, IGÉNYES KIVITELEZÉS - NAPPALI + 3 SZOBA, 2 FÜRDŐ, 3 DB. NAGY TERASZ, DUPLA GARÁZS - HŐSZIVATTYÚ PADLÓFŰTÉSSEL Megbízható beruházó, referencia ingatlanok megtekinthetők! Érdliget dombos részén csendes, családi házas övezetben 1061m2-es panorámás telken belső kétszintes + garázs szint, nappali + 3 szobás, dupla komfortos, összesen 195.21m2-es (+ 3 db. nagy terasz), új építésű LUXUS önálló családi ház leköthető igény szerinti befejezéssel. Az ingatlan szintenkénti felosztása a következő: Garázs szint (65.33m2): közlekedő (2.75m2), gépészeti helyiség (7.5m2), tároló (9.1m2), lépcső (7.04m2), 2 gk-s garázs (38.94m2). Földszint (64.79m2 + terasz): közlekedő (6.34m2), wc (1.8m2), mosókonyha (5.52m2), kamra (3.42m2), nappali-étkező (34.16m2) - konyha (6.18m2), lépcső (7.37m2), terasz (37.15m2). Emelet (65.09m2 + teraszok): közl...",,,https://ingatlan.com/34728780
66,,,,,,,,2001 és 2010 között,2,,felújított,"gázkazán, hűtő-fűtő klíma, kandalló",,udvari beálló - benne van az árban,,,,bizonytalan,"ÁRZUHANÁS! HIHETETLEN ÁR-ÉRTÉK ARÁNY! ÉRD ÉS DIÓSDLIGET HATÁRÁN ELADÓ EGY MINDEN FÖLDI JÓVAL FELSZERELT 5 SZOBÁS, PANORÁMÁS CSALÁDI HÁZ, ELLENÁRAMOLTATÓS MEDENCÉVEL, SZAUNÁVAL, VÍZESÉSSEL, KERTI SZALETLIVEL, HATALMAS TERASZOKKAL, kinti konyhával és sütögetővel 1250 m2-es GYÖNYÖRŰ ZÖLD KÖRNYEZETBEN! Családi összejöveteleket és társaságot kedvelőknek igazi kánaán! A ház 1996-ben épült, szigetelt. 2014-ben felújították, akkor épült az ellenáramoltatós medence, szauna, kerti szaletli. Az épületet modernizálták. Központi fűtéses (vízteres) kandalló, alternatív megoldásként betápláló napelemes rendszer (folyamatban) és inverteres hűtő-fűtő klima is segíti az energiatakarékos megoldásokat. AZONNAL KÖLTÖZHETŐ! További információk:",,,https://ingatlan.com/33222328
67,,,,,,,,2025,2,,,"hőszivattyú, padlófűtés",,teremgarázs hely - benne van az árban,,,,ingatlaniroda,"Hivatkozzon erre, kód: 3873KE - ÚJ ÉPÍTÉS - SAJÁT UTCAFRONTI BEJÁRAT - PANORÁMA - NAPPALI + 4 SZOBA + DUPLA GARÁZS - HŐSZIVATTYÚ PADLÓFŰTÉSSEL AZ ÁR LAKÁSONKÉNT ÉRTENDŐ! Megbízható kivitelező, számos referencia ingatlan megtekinthető! Érdliget kedvelt részén, természet közeli környezetben, 637nm2-es összközműves telken, saját utcafronti bejárattal rendelkező új építésű, belső kétszintes + garázs szint, nappali + 4 szobás, dupla garázsos, összesen nettó 157.39nm-es (+ 53.28nm teraszok) ikerházi lakások eladók, igény szerinti befejezéssel! Még az ikerház mindkét oldala elérhető! Felosztásuk a következőképpen alakul: Utcaszinten: garázs (35.16nm). Földszinten: fedett előtér (1.70nm), előtér (4.62nm), mosdó-wc (2.10nm), konyha-étkező (16.60nm), nappali (27.45nm), szoba (12nm) terasz (panorámás - 41.52nm + hátsó terasz 11.76nm). Emeleten: lépcsőház (4nm), közlekedő (8.85nm), wc (1.35nm), fürdő (6.86nm), 3 szoba (13.10nm és 2 db 11.80nm), Rövid műszaki ismertető: Beton alap. 30-as tégla fala...",,,https://ingatlan.com/32717512
68,,,,,,,,1950 és 1980 között,3,,közepes állapotú,gázkazán,,önálló garázs - benne van az árban,,,,maganszemely,"Érdliget, Csaba utcában közvetlenül tulajdonostól eladó családi ház. Az ingatlan hasznos alapterülete 193m2, melyet három szint alkot. A földszinti részen került kialakításra a garázs, tárolóhelyiség, kazánház valamint egy szoba. Az emeleten konyha, kamra, fürdőszoba, Wc és három szoba található. A beépített tetőtérben plusz egy konyha, fürdőszoba, Wc és további két szoba kapott helyet. Fűtése és meleg víz ellátása gázkazánnal megoldott, radiátorokkal. Nyílászárói fa szerkezetű ablakok és ajtók. Kellemes, családi házas környezetben helyezkedik el, autóval és tömegközlekedéssel egyaránt könnyű megközelíteni. A legközelebbi buszmegálló mindössze 70 m-re található. Bevásárlási lehetőség, kereskedelmi és szolgáltató egységek, közintézmények szintén karnyújtásnyira elérhetők. Kérdéseivel, megtekintésre történő időpont egyeztetéssel kapcsolatban forduljon hozzám bizalommal!",,,https://ingatlan.com/33673594
69,,,,,,,,,2,,befejezetlen,,,önálló garázs,,,,maganszemely,"Külvárosi nyugalom, polgári kényelem, nyaralás helyben! Érd Parkvárosának egyik átmenő forgalomtól mentes utcájában egy olyan ideális élettér kerül kialakításra, amely méretéből adódóan egy nagyobb család együttéléséhez, vagy akár a két lakrész különválasztásával két generáció összeköltözéséhez is megfelelő. A ház építés, a kert rendezés alatt áll! Az alsó szint lakható, nagy nappali, konyha, két háló, nagy fürdő, teraszok. A felső szint teljes egészében kialakításra vár. A feljárat az emeletre még megoldható akár belső, akár külső megközelítéssel is, így a fenti lakrész külön-bejáratúvá is tehető. Kialakításra vár két szint, két lakótér, összesen 6 szoba, 2 fürdő, 1+1 konyha, teraszok. Sőt! A 800 m2-es telek elrendezése szerencsés, kihasználhatósága remek, nyaralóként is tökéletes! A 33 méteres utcafront két külön bejárattal, két nagy kapuval rendelkezik. Baloldalon a 2 szintes, 220 m2-es családi ház, 60 m2-es pinceszinten kialakított garázzsal, a jobb oldalon a nyaraló-terület építet...",,,https://ingatlan.com/34739352
70,,,,,,,,1981 és 2000 között,2,,jó állapotú,gázkazán,,önálló garázs - benne van az árban,,,,ingatlaniroda,"Az AVENT INGATLAN kínálatában - Érdligeten eladó családi ház! Érdliget és Postástelep határán, aszfaltozott úton eladó ez a jó állapotban lévő, akár több generáció számára is ideális otthon! A ház földszintjén tágas konyha-étkező-nappali található egy légteret alkotva, továbbá kamra, fürdőszoba, WC, terasz. Az emeleten nappali, 3 hálószoba, fürdőszoba, WC kapott helyet. A szuterén szinten 75 m2-es helyiség lett kialakítva, mely tökéletes tere lehet irodának, raktárnak vagy akár hobbi szobának is. A parkosított kertben öntözőrendszer, borospince, kiépített grillező található. További extrák: * riasztó * elektromos vezérlésű kapu és garázsajtó * fúrt kút Parkolásra 1 állásos garázs szolgál, további autó beállási lehetőség telken belül lehetséges. Az ingatlan övezeti besorolásának köszönhetően (Vt-1/I övezet) a jelenlegi építmény mellé még akár egy újabb többlakásos épület is építhető a jelenleg érvényben lévő HÉSZ szerint. Kiváló elhelyezkedés, jó tömegközlekedés. Bevásárlási lehetőség, ...",,,https://ingatlan.com/33197430
71,,,,,,,,2017,4,,újszerű,"gázkazán, mennyezeti hűtés-fűtés, padlófűtés",,teremgarázs hely - benne van az árban,,,,maganszemely,"Hivatkozzon erre, kód: 4789 ÉRDLIGETEN ELADÓ EGY LENYŰGÖZŐ, EGYEDI MEGOLDÁSOKKAL ELLÁTOTT ÖRÖK PANORÁMÁS, KÖZEL 600M2 ALAPTERÜLETTEL RENDELKEZŐ CSALÁDI HÁZ, TÖBB MINT 1000M2-ES PARKOSÍTOTT TELKEN, AMELY A MODERN IGÉNYEKET ÉS AZ ELEGANCIÁT ÖTVÖZI! Elhelyezkedés: A családi ház Érd-Liget és Diósd határán, a város egyik kivételesen nyugodt és kedvelt részén található, így az itt élők élvezhetik a főváros közelségét anélkül, hogy lemondanának a csendről és a természetről. Ez az ingatlan nem csupán egy lakóhely, hanem egy életstílus, amit azoknak ajánlunk, akik a mindennapjaikban is a kényelmet és az eleganciát keresik. Az otthon melegét, az építészet finomságát és a modern technológia adta lehetőségeket egyaránt megtalálja itt. Felosztás: A 4 szintes épületben helyet kapott egy nagy, tágas nappali, külön konyha – étkező egyedileg készített, tömörfa konyhabútorral, télikert, 8 hálószoba (melyek bármelyikéből igény szerint akár dolgozószoba is lehet), 3 fürdőszoba, szintenként külön mellékhel...",,,https://ingatlan.com/34467983
72,,,,,,,,2026,2,,,"hőszivattyú, padlófűtés, hűtő-fűtő klíma",,teremgarázs hely - benne van az árban,,,,ingatlaniroda,"Hivatkozzon erre, kód: 4984 - ÚJ ÉPÍTÉSŰ ÖNÁLLÓ HÁZ - CSENDES, ERDŐS, ZÖLD ÖVEZET - IGÉNYES KIVITELEZÉS - NAPPALI + 3 SZOBA + TERASZ + 2 GK-S GARÁZS - MEGBÍZHATÓ BERUHÁZÓ, SZÁMOS REFERENCIA Érdliget kedvelt részén madárcsicsergős, erdős zöldövezetben 538m2-es telken nappali + 3 szobás + pince szinten 2 gk-s garázs, összesen nettó 140.3m2-es (+ terasz), új építésű önálló családi ház leköthető igény szerinti befejezéssel! Várható átadás: 2026. I. negyedév! A képek között referencia ingatlan is látható! Az ingatlan felosztása a következő: Pince szint (50.3m2): 2 gk-s garázs (27.06m2), gépészeti helyiség (4.82m2), tároló - dolgozó (11.25m2), előtér-lépcső (7.17m2). Földszint (90m2 + terasz): előszoba (6.28m2), közlekedő (4.64m2), amerikai konyha - nappali (41.1m2), háztartási helyiség + wc (2.87m2), fürdőszoba + wc (4.18m2), 3 szoba (9.43m2, 12.21m2, 9.29m2), terasz (14.5m2). Szerkezeti leírás: Beton alap. 30-as tégla főfalak + 15cm dryvit szigetelés. 10-es tégla válaszfalak. A külső nyílá...",,,https://ingatlan.com/34827079
73,,,,,,,,1950 és 1980 között,2,,felújított,gázkazán,,udvari beálló - benne van az árban,,,,ingatlaniroda,"Eladó a képeken látható kétszintes, 2 generációs (külön bejáratú), jó állapotú, 1976-ben épült, 2019-ben felújított családi ház Érdligeten. Az ingatlan az alábbi helyiségekből áll: Földszint (85 m2): nappali, hálószoba, fürdőszoba, konyha Emelet (65 m2): nappali, 2 hálószoba, fürdőszoba, szeparált konyha, vendég mosdó, 8 m2-es erkély. Az ingatlanban korszerű gázkazán biztosítja a fűtést, de egy vegyes-tüzelésű kazán is rendelkezésre áll, a hűtéshez pedig légkondicionáló. Felújításkor a régi ablakok helyére műanyag nyílászárók kerültek, illetve az épület 8 cm szigetelést is kapott. A falak B-30-as téglából épültek, betongerendás tetőszerkezettel. Közlekedés kitűnő, óvoda, boltok a közelben. Fedett gépkocsibeálló két jármű számára biztosított. Egyéb információkkal és megtekintéssel kapcsolatban keressen bizalommal.",,,https://ingatlan.com/34576841
74,,,,,,,,1981 és 2000 között,,,jó állapotú,gázkazán,,önálló garázs,,,,ingatlaniroda,"NAGYRAVÁGYÓKNAK! ÉRDLIGETEN, KERESETT RÉSZEN ELADÓ KÖZEL 500 M2-ES HÁZ 1977 M2 TELEKTERÜLETTEL ! Rendezett környék, szép házak környezetében , aszfaltos utcában található.Az ingatlan 1995-ben épült saját célra, azóta is a család tulajdonában van, Az épületet jelenleg 3 külön lakásként használják. Földszinten 2 lakás lett kialakítva külön bejárással, 1 lakás pedig az emeleten. Amennyiben befektetésen gondolkodik nagyon jó lehetőség kiadás szempontjából a 3 lakás, illetve a telek adottságai miatt a hátsó telek rész külön értékesíthető vagy építhető rá külön ingatlan. Könnyedén visszaalakítható, hogy újra 1 házként funkcionáljon. Az ingatlan felújítandó, korszerűsítésre, modernizálásra van szüksége, viszont saját ízlése és igénye szerint teheti ezt és ez által egy tökéletes luxus otthont tudhat magáénak. Műszaki adatok: - 38 cm-es YTONG falazat - Fűtése gázkazán, alternatív fűtés egy hangulatos kandalló a nappaliban - Nyílászárók fa kivitelűek, 2 rétegű thermo üvegezéssel - Velux tetőtéri...",,,https://ingatlan.com/34221737
75,,,,,,,,1950 és 1980 között,,,közepes állapotú,"gázkazán, cserépkályha",,,,,,maganszemely,"EGYSZINTES, 3 SZOBÁS CSALÁDI HÁZ ÉRDLIGETEN ELADÓ!!! Érdliget kedvelt részén, karnyújtásnyira a Papi földek szabadidőpark mellett kínálunk eladásra egy 768 nm-es összközműves telken lévő, egyszintes családi házat. A ház 1972-ben téglából épült, nettó 90 nm alapterületű, mely 3 szoba, konyha, étkező, fürdőszoba (wc-vel), előszoba, kamra és 2 közlekedő helyiségekből áll, továbbá két fedett terasz is kialakításra került (25 és 7 nm). Az ingatlanban a meleg ellátásáról gáz cirkó rendszer és egy hangulatos cserépkályha gondoskodik. A közeli Szabadidőpark ideális lehetőséget biztosít a pihenésre és a szabadidős tevékenységekre, így a ház tökéletes választás lehet családok számára, vagy azok számára, akik szeretik a természet közelségét és a kiemelkedő szabadidős lehetőségeket. További információkért keressen bizalommal! Irányár: 64,9 mFt",,,https://ingatlan.com/34738794
76,,,,,,,,1981 és 2000 között,,,közepes állapotú,gázkazán,,udvari beálló - benne van az árban,,,,maganszemely,"Érd-ligeten kertvárosi környezetben, a Fűzfa utcában, kínálok megvételre, panorámás kilátással egy önálló családi házat. ÉPÍTÉSI TELEKNEK IS MEGFELELŐ ! A ház 1981-ben épült, hasznos alapterülete 55 m2. Elrendezése szoba 15 m2, konyha+étkező 15 m2, WC fürdő 7 nm, 1 fél szoba 10 nm,előtér 3 nm helységekből áll. Téglából épült, szerkezetileg jó állapotú, világos, természetes belső terekkel, a nagy ablakoknak köszönhetően. Fűtése gázcirkóval, radiátoros hőleadókkal megoldott. A házon 2014- ben részben tetőcsere volt, cserépfedéssel, fürdőszoba és WC-ék kompletten felújításra kerültek. A ház mellett elkezdett garázs, körülötte rendezett udvar és kert termő gyümölcsfákkal. Érd központ, vasútállomás 10 perc, buszmegálló 10 percnyire gyalogosan. Orvosi rendelő, bolt gyalogtávolságra. Ajánlom mindazon gyerekes házaspároknak, akik egy igazán kiváló, jól megközelíthető, jó adottságokkal rendelkező, csendes, nyugodt helyen szeretnék élni a mindennapjaikat. Ha szeretne kiszabadulni a városi körfor...",,,https://ingatlan.com/32798399
77,,,,,,,,1950 és 1980 között,,,közepes állapotú,gáz (konvektor),,önálló garázs - benne van az árban,,,,ingatlaniroda,"--- ÉRDLIGETEN, CSENDES MELLÉK UTCÁBAN, VASUTHOZ, BUSZOKHOZ ÉS MINDENHEZ IS KÖZEL, JÓ ADOTTSÁGÚ TELEK, FELUJITANDÓ HÁZZAL --- AZ INGATLAN ÉRDLIGET VASUTÁLLOMÁSTÓL PÁR UTCÁNYIRA TALÁLHATÓ, CSENDES MELLÉK UTCÁBAN. A telek sík, 20 méteres utcafrontja van. A telken található egy 55 nm-s tégla ház terasszal és egy különálló 20 nm-es, szintén tégla építésű, különálló épület. A HÁZ elrendezése 2 szoba, konyha, étkező, fürdőszoba, előszoba. Fűtése gázkonvektorral és kandallóval megoldott. A KISHÁZAT nyárikonyhaként használták. Ide is be vannak vezetve a közművek. Ez az épület egy helyiségből és egy toalettből áll. Térképen mindkét épület fel van tüntetve. A ház és a kisház is szerkezetileg stabil, nincsenek repedések, felázás vagy penészesedés. A telek összközműves, víz, gáz, csatorna, villany bevezetve. A kertben fúrt kút is van. A TELEK Vt-1/l ÖVEZETBEN TALÁLHATÓ. Ha nagyobb ingatlanra vágyik, a meglévő ház elbontható, vagy bővíthető. Vt-1/l övezeti besorolású telkek: - beépítési módja: szab...",,,https://ingatlan.com/34792317
78,,,,,,,,1981 és 2000 között,2,,újszerű,"hűtő-fűtő klíma, hőszivattyú",,udvari beálló - benne van az árban,,,,bizonytalan,"Érdligeten eladó frissen és teljeskörűen felújított, azonnal költözhető, nettó 130 nm-es (bruttó 153 nm), amerikai konyha-nappalis, 3 hálós, duplakomfortos, légkondicionált, modern és igényes, tehermentes, albetétesített, hitelezhető ikerház fél, 190 nm-es saját leválasztott kerttel (saroktelken). Igény esetén a fotókon és videón látható bútorozottsággal is birtokba vehető - az árban benne van. A ház az 1970-es években épült. A tető felújítása 6 éve történt meg, kifogástalan állapotban van. Ezen és a szintén tökéletes állapotú konyhabútoron kívül minden modernizált, felújított. A fűtésről jelenleg hűtő-fűtő klíma gondoskodik, de a teljes műszaki előkészítés megtörtént a hőszivattyúhoz is igény esetén. A házban a friss levegőt a non-stop működő gépi szellőzés biztosítja. A házhoz kis terasz, előkert és egy zöld, lekerített kert tartozik. A kertben 2 gépkocsinak a beállás megoldható (igény esetén a beálló fedetté tehető). Falakon 15 cm-es dryvit, a tetőtérben pedig 2 komponensű fújthab s...",,,https://ingatlan.com/34087169
79,,,,,,,,2012,2,,újszerű,"gázkazán, padlófűtés, kandalló",,önálló garázs,,,,maganszemely,"AMERIKAI STÍLUSÚ LUXUSVILLA ÉRDLIGETEN Közel 700 nm-es impozáns ingatlan 2012-ben épült, több mint 2000 nm-es panorámás telken. Bejárata egy nagy méretű fogadószobába nyílik,ahonnan a hatalmas étkező-konyha-nappali közelíthető meg. Ezen a szinten kapott helyet a szülői hálószoba gardróbbal és fürdőszobával,a hobbi szoba szaunával és gőzkabinnal,valamint a mosókonyha és és egyéb kiszolgáló helyiségek. Több irányból kijuthatunk az összesen 150 nm-es teraszra,onnan a gyönyörű kertbe,ahol fűtött medence,halas tó,jakuzzi és egy madárkert található. Az emeleten 2 különálló lakrész lett kialakítva. Mindkettő saját nappalival,hálószobával, gardróbbal,fürdőszobával és panoráma terasszal rendelkezik. Ezen a szinten található még plusz egy vendégszoba fürdővel. A házhoz egy nagyméretű garázs tartozik,ahol 4 db autó is kényelmesen elfér. Tavasszal az összes fürdőszoba komplett felújításon esik át,így teljesen újonnan kerül az új tulajdonos birtokába. Fűtésről gázkazán gondoskodik padlófűtéssel és ...",,,https://ingatlan.com/34698024
80,,,,,,,,,,,közepes állapotú,"gáz (konvektor), kandalló",,udvari beálló - benne van az árban,,,,maganszemely,"Alacsony fenntartású, önálló családi ház eladó. A Szabadidőpark (Záportározó) szomszédságában eladó egy földszintes, alacsony rezsiköltségű, különálló, (nem iker!) saroktelken levő, nettó 64m2-es családi ház. Az telek 412m2-es, melyen szőlő, meggyfa található. A házban 2 különálló szoba, étkezős konyha, fürdőszoba, előszoba és közlekedő található. Fűtése gázkonvektoros, illetve van egy kandalló is. Bár az utóbbit mi nem használtuk évek óta, de kipróbáltuk, jól működött. A ház bejáratánál van egy kis terasz, a hátsó kertben pedig egy két részre osztott tároló (2 külön bejárattal) és egy ól, ami szintén tárolóként funkcionál. Az ingatlan lakható állapotban van, jelenleg is lakjuk, csak ""kinőttük"". Konyhában, közlekedőben, fürdőszobában, szobában pvc van, előszobában járólap, nappaliban laminált padló. Fürdőszobában, konyhában új villanyboyler. A ház tégla építésű és cseréptetős. A tető fa gerendás. A szobák ablakain redőnyök vannak. Továbbá van éjszakai áram, telken belül 1-2 autó beállá...",,,https://ingatlan.com/33523262
81,,,,,,,,2024,2,,,"hőszivattyú, padlófűtés, fan-coil",,udvari beálló - benne van az árban,A+,,,maganszemely,"ÖRÖKPANORÁMÁS, ÚJ ÉPÍTÉSŰ LUXUS CSALÁDI HÁZ ELADÓ ÉRD - DIÓSD HATÁRÁN Képzelje el, hogy minden reggel a LENYŰGÖZŐ PANORÁMÁBAN ébredhet! Eladó egy ÖRÖKPANORÁMÁS, ÚJ ÉPÍTÉSŰ, PRÉMIUM kategóriás családi ház Érd és Diósd határán ősfás környezetben Érd egyik legkeresettebb, csendes részén új építésű házakkal körülvett részén. Ez a 150 m²-es, nappali + 5 szobás LUXUSOTTHON a legmodernebb technológiával és prémium minőségű anyagokkal épült, hogy a legmagasabb kényelmet és időtállóságot biztosítsa. Minden részletében a LUXUST, a PRÉMIUM ÉLETMINŐSÉGET képviseli. FŐBB JELLEMZŐK: 150 nm lakótér + 101 nm terasz Nappali + 5 szoba – tágas, világos terek 3 fürdőszoba – prémium minőségű szaniterekkel Háztartási helyiség és gardrób – praktikus tárolási megoldások Különálló tároló és autóbeálló Földszint: 110,55 nm lakótér, 9,06 nm és 9,33 nm terasz Emelet: 40 nm lakótér, 2,85 nm terasz 80 nm-es panorámaterasz – lélegzetelállító kilátás CSÚCSTECHNOLÓGIÁS MŰSZAKI MEGOLDÁSOK: A+ energetikai besorolás – al...",,,https://ingatlan.com/34542753
82,,,,,,,,1950 és 1980 között,2,,közepes állapotú,gázkazán,,önálló garázs - benne van az árban,,,,maganszemely,"Érdligeten, csendes, közkedvelt utcában, 2 generációs családi ház eladó! A 818 nm-s telken két ház található, melyek két különböző utcáról közelíthető meg. Mindkét ház külön mérőórákkal rendelkezik, a kert középen elválasztható. A nagyobb ház földszintje 77 nm-s, nappali, szoba, konyha és fürdőszoba, az emelet 68 nm-s, nappali, két szoba, konyha és fürdőszoba. Hozzá építettek még egy szobát, ahonnan nyílik a nagy ház alatti alagsori szint, kazánházzal és tárolókkal. Autóval a fedett beállóban parkolhatunk. A fűtés gáz cirkóval és gázkazánnal megoldott, nyílászárók korszerű műanyag keretesek. Minden közmű külön mérhető! A kisebbik ház 80 nm-s, ami egy hatalmas nappaliból, fürdőszobából és egy szobából áll, amit elkezdtek konyhának kialakítani. A ház mellet található egy 20 nm-s tároló és egy fedett kerekeskút és egy saját garázs. A fűtés gáz cirkóval megoldott, nyílászárók korszerű műanyag keretesek. Minden közmű külön mérhető! Ha bármi további kérdése van, kérem hívjon bizalommal! HITE...",,,https://ingatlan.com/33592324
83,,,,,,,,1981 és 2000 között,3,,jó állapotú,házközponti,,,,,,bizonytalan,"Érdliget területén várja új tulajdonosát egy 90-es évek közepén épült, közel 600 m2-es kastély jellegű, jó állapotban lévő ingatlan, 2.592 m2-es telken. A házhoz dupla garázs tartozik, ill. ősfákkal, szökőkúttal díszített park található, a kertben fúrt kúttal. Az épület földszinti részén elegáns előszoba, dolgozószoba, mellékhelyiség, konditerem, szauna, mosókonyha, ill. a gépészet található. Innen belső átjáróval jutunk a garázsba. A főbejárat előtt fedett gépkocsi fogadó. A lépcsőházban lift beállítására alkalmas hely lett kialakítva. A középső szinten található egy konyha étkezővel, 36 m2-es terasszal, tölgyfából készült főzőszigetes konyhapult, melyen gránit munkalap van, ill. tágas, világos nappali, zöld márvány kandallóval. A nappaliból nyílik egy 46 m2-es terasz és az épület a déli oldalra is kijárattal rendelkezik, mely egy belátás mentes zárt része a teleknek. Szintén ezen a szinten található egy 40m2-es 2 m mély, feszített víztükrös, függesztett medence is, amely mellett zöld...",,,https://ingatlan.com/33001422
84,,,,,,,,2025,2,,,"hőszivattyú, padlófűtés",,önálló garázs - benne van az árban,,,,bizonytalan,"KÉT GYÖNYÖRŰ, PANORÁMÁS ÚJ ÉPÍTÉSŰ IKERLAKÁS ELADÓ ÉRDLIGET CSENDES UTCÁJÁBAN, SAJÁT TELEKKEL 90%-OS KÉSZÜLTSÉG, ÁTADÁS ADÁSVÉTELTŐL SZÁMÍTOTT EGY HÓNAP! Érdliget csendes mellékutcájában kínálunk megvételre egy igényes kivitelezésű, ALACSONY REZSIJŰ, PANORÁMÁS, HŐSZIVATTYÚS, DUPLAGARÁZSOS, bruttó 210 nm-es (nettó 157 nm), nappali + 4 szobás, tágas amerikai konyhás, ÚJ ÉPÍTÉSŰ ikerházi lakást, a hozzá tartozó 637 nm-es telekkel. Műszaki tartalom: •Az alapban C16-os mixerbeton, a koszorúban és födémben C20-as mixerbeton. Aljzatbeton ESTRICH. •Falazat: 30-as Porotherm tégla. Kívülről 15 cm-es DRYVIT. Felül 25 cm-es kőzetgyapot szigetelés. A válaszfal 10-es válaszfaltégla. Falak kétszer glettelve, fehér színre festve. •Tető: 1. osztályú impregnált faanyag, antracit betoncserép. •Nyílászárók: 3 rétegű, 5 légkamrás, bukó-nyíló, redőnnyel és szúnyoghálóval ellátva •A ház fűtéséről és melegvíz-ellátásáról HŐSZIVATTYÚ gondoskodik, a hőleadás padlófűtésen keresztül történik. •H-Tarifa •Választha...",,,https://ingatlan.com/34670444
