id,cim,reszletes_cim,teljes_ar,reszletes_ar,terulet,nm_ar,szobak,epitesi_ev,szint,allapot,ingatlan_allapota,futes,erkely,parkolas,energetikai,tajolas,kert,hirdeto_tipus,leiras,ingatlanos,telefon,link
1,,,,,,,,1981 és 2000 között,,,,"gázkazán, kandalló, hűtő-fűtő klíma",,önálló garázs - benne van az árban,F,,,ingatlaniroda,"Tisztelettel megkérem az ingatlanközvetítőket, hogy ne (tényleg ne!) keressenek! Érd legjobb részén - Érdligeten -, Diósd határán családi ház eladó. A legfontosabb jellemzői: - 1022 m2 telekterület, - 133 m2 alapterületű (+27 m2 terasz, +2 garázs (23 és 27 m2), -kiváló(!!!) elhelyezkedés Gyalogosan 5 percre Érdliget központjától (park, játszótér, bevásárlási lehetőség (Lidl), gyógyszertárak stb.), 8 percre az érdligeti vasútállomástól (Kelenföld 15perc, Érd központ 2 perc). Szintén sétatávra pékségek, éttermek, cukrászda, orvosi rendelők találhatóak. Gépjárművel M0 és M6 5-5 perc alatt, M1-M7 10-10perc alatt elérhető. -szuper elrendezés (kérem, tekintse meg a videóbemutatót!) A főbejáratot fedett teraszon tudjuk megközelíteni. Az előszobából mellékhelyiség, valamint egy kisszoba (~7 m2, mi dolgozónak használjuk) nyílik. Az előszobából továbbhaladva az étkező és a konyha következik. Innen nyílik egy kis kamra/spejz, valamint mosókonyha, ahonnan az egyik garázsba juthatunk ki. Az étkezőb...",,,https://ingatlan.com/34877062
2,,,,,,,,2025,,,új építésű,"hőszivattyú, padlófűtés",,önálló garázs - benne van az árban,,,,ingatlaniroda,"Hivatkozzon erre, kód: 4890TSZ - ÚJ ÉPÍTÉSŰ ÖNÁLLÓ HÁZ - IGÉNYES KIVITELEZÉS - NAPPALI + 4 SZOBA + 2 FÜRDŐ + 1 GK-S GARÁZS + TERASZ - HŐSZIVATTYÚS FŰTÉS Érdliget kedvelt részén 560nm-es kiváló adottságokkal és privát szférával rendelkező összközműves telken nappali + 4 szobás + 1 gk-s garázs, dupla komfortos, összesen 137.2nm-es (+ terasz), új építésű önálló családi ház igény szerinti befejezéssel leköthető. Várható átadás: 2025. év vége!! Megbízható beruházó, több éves tapasztalat, számos referencia ingatlan! A fotók már eladott házakról készültek, amelyek akár személyesen is megtekinthetők! Felosztás a következőképpen alakul (137.2nm + terasz 22nm): előszoba (4.8nm), konyha (8.4nm) – étkező – nappali (39.6nm), közlekedő (7.4nm), fürdőszoba + wc (8.9nm), privát fürdőszoba wc-vel (3.9nm), szoba (11.2nm), szoba (10.8nm), szoba (11.3nm), szoba (10.7nm), garázs (20.2nm). Szerkezeti leírás: Beton sávalap. 30-as tégla főfalazat + 15cm dryvit szigetelés. 10-es tégla válaszfallapok. Fa födém ...",,,https://ingatlan.com/34636924
3,,,,,,,,2001 és 2010 között,3,,felújított,gázkazán,,önálló garázs - benne van az árban,,,,ingatlaniroda,"Érd ""Rózsadombján"", Érdligeten kínálunk megvételre egy 157 nm-es 3 szintes, kiváló állapotú, örök körpanorámás családi házat. A ház csendes, nyugodt utcában, igényes luxusingatlanok szomszédságában található. A 660 nm-es telek szinte sík, de mivel a dombtetőn helyezkedik el, csodás örök körpanoráma tárul elénk Budapestre és a környező településekre, melyet majd minden helyiségből élvezhetünk. Az ingatlan 2006-ban épült újjá 30-as téglából, 8 cm-es szigeteléssel. Az 5 szobás családi ház remek elosztással rendelkezik. A szuterén szinten kazánház, mosókonyha és egy szabadidő szoba található. A földszinten nappali, 1 szoba, konyha, spejz, kádas fürdőszoba Wc-vel kapott helyet. A legfelső szinten 3 szoba van, melyek mind különnyílóak, közülük a legnagyobb egy 25 nm-es, csodálatos körpanorámával rendelkező, félköríves, fagerendás mennyezeti kialakítású akár szülői hálónak is használható szoba továbbá 2 hálószoba és egy zuhanyzós fürdőszoba Wc-vel található. Az épület kifogástalan állapotban ...",,,https://ingatlan.com/34668306
4,,,,,,,,2001 és 2010 között,,,jó állapotú,gázkazán,,önálló garázs,,,,maganszemely,"Csendes utca gyér forgalommal, körbejárható családi ház, nagy terasz elöl és hátul is, nagy kert rengeteg fával és cserjével, privát élettérrel, külön épület az autóknak, irodának, rendelőnek. Eladásra kínáljuk ezt az Érdligeti, 1.636 m2-es telken elhelyezkedő 126 m2-es francia stílusú családi házat, amely egy enyhén emelkedő, hosszú telek végére épült, kellemes távolságra az utcafronttól, így a külső szemlélők elől rejtve marad, köszönhetően a nagyszerű tájolásnak, a körbeölelő, eltakaró természetnek. Bejárat az első nagy teraszról. Nagy középső tér a nappali-étkezőnek, közlekedőnek. Konyha és kamra, mosdó, mosókonyha, dolgozószoba az egyik oldalon, fürdő, két háló és közöttük nagy gardrób a másik oldalon. Kétoldalt is, középen is kijárat a kívülről sehonnan sem látható hátsó teraszra. Bár a konyha és a fürdőszoba nem felel meg a mai divatnak és a modern elvárásoknak, egy ötletes tervezés, szakszerű felújítás után is megőrizheti francia eleganciáját és báját. Fa szerkezetű tető és men...",,,https://ingatlan.com/34739143
5,,,,,,,,1981 és 2000 között,2,,újszerű,"hűtő-fűtő klíma, elektromos fűtőpanel",,udvari beálló - benne van az árban,,,,ingatlaniroda,"AZONNAL KÖLTÖZHETŐ! MINŐSÉGI ANYAGOKKAL KIVITELEZETT, ALACSONY REZSIVEL FENNTARTHATÓ INGATLAN! Érdliget csendes utcájában, frekventált környéken, a központhoz közel ELADÓ egy 100 m2-es (hasznos tér), belső két szintes, 3 szoba + nappalis, TELJESKÖRŰEN FELÚJÍTOTT IKERHÁZ fél, hozzátartozó 300m2-es telekkel! Szép tágas, napfényes terek jellemzik, elosztása a következőképpen alakul: földszinten: konyha, nappali, WC, terasz emeleten: 3 szoba, fürdő, WC, erkély. A ház teljeskörű felújításon esett át, mely magában foglalja a komplett tető (betoncserép)-, a víz-villany hálózat-, a nyílászárók (több rétegű műanyag)-, beltéri ajtók-, burkolatok-, szaniterek cseréjét, emellett a külső homlokzatra (30’ tégla) 15 cm dryvit-, a födémre 30 cm kőzetgyapot szigetelés került. Ikerház lévén a kellő intimitást megtartva a közös falra mindkét oldalról 5 cm kőzetgyapot szigetelés-, és akusztikus karton került. Meleg víz ellátásáról villanybojler-, fűtéséről 3 db inverteres klíma valamint 3 db norvég fűtőpa...",,,https://ingatlan.com/34866524
6,,,,,,,,,,,,,,,,,,bizonytalan,"Eladó Érdligeti (korábban Diósdliget) ""gyöngyszem"". 856 m2 telek felújítandó vagy bontandó kőházzal. Központi (40m2) elhelyezkedés, de mégis intim élettérrel. A felújítás elkezdődött, egy 20m2 es lakható melléképület el is készült. Érvényes építési engedély van a bővítésre. (akár ikerház is építhető rá) Érdeklődni a + és a számon",,,https://ingatlan.com/34623319
7,,,,,,,,1950 és 1980 között,,,felújítandó,"gázkazán, vegyes tüzelésű kazán",,önálló garázs - benne van az árban,,,,maganszemely,"ELADÓ PANORÁMÁS FELÚJÍTANDÓ INGATLAN Érdliget legjobb részén! Befektetőknek és családosoknak is ajánlott A 3%-os Otthon Start Programra alkalmas! Ingatlan jellemzői: - Saroktelek Érdliget kedvelt, csendes, panorámás részén, közel a Papi Földek Záportározó és Rekreációs Parkhoz. - Terület: teraszos jellegű kerttel. - Telek Vt-2-es besorolású, amely: 60% beépíthetőség, 20% zöldterületi mutató, 1,8-as szintterületi mutató, 12 m legnagyobb homlokzatmagasság, szabadonálló beépítési mód - 1/1 tulajdon, abszolút tehermentes ingatlan! Épület és melléképületek: - Családi ház tetőszerkezete 12 éve felújított, nyílászárók cserélve, fürdőszoba felújítva, mindamellett a ház belsőleg felújításra szorul! - A ház sajnos nem rendelkezik szigeteléssel, csak a tető - így az megoldásra vár - Fűtés: gáz cirkó + pincei vegyes tüzelésű kazán - Külön garázs: 15 nm-es téglából épült, elektromos kapuval - Filagória: 6 személyes, a kertben, panorámás kilátással Nagytétény és Lakihegy irányába - Kert: teraszos ki...",,,https://ingatlan.com/34811762
8,,,,,,,,2025,3,,,"hőszivattyú, padlófűtés, mennyezeti hűtés-fűtés",,önálló garázs,A++,,,ingatlaniroda,"Érdliget csendes aszfaltos utcájában, részben lejtős, a szemközti domboldalra panorámás területen építjük fel a legmagasabb igényeket kielégítő, korszerű, minőségi, kreatívan és gondosan megtervezett otthonát. Építész-építőmérnök párosként 35 év tapasztalattal rendelkezünk. Referenciánkban több mint 300 projekt, több mint 50 felépített családi ház. A tervezett épület minőségének megfelelő kész referenciaházat mutatunk. Két beállós garázs, valamint több férőhelyes, árnyékos parkoló telken belül. Buszmegálló, óvoda, Lidl élelmiszerbolt 1300 m-en belül. Az autópályák zaja nem hallható, ellenben könnyen, gyorsan elérhetők. -ingatlan területe 1580 m2 (utcafront 26,5m széles, hosszú oldal 64m) -épület hasznos alapterülete 298 m2 + garázs és tároló 67 m2 -teraszok + 145 m2 -kerti épület + 22 m2 -fedett terület jakuzzi és szauna részére + 23 m2 -napozóterasz + 108 m2 -12 x 2,5 m úszómedence Az épület villamossági, gépészeti tudását az Ön igényeihez igazítjuk. Kis mértékben az alaprajzon is vál...",,,https://ingatlan.com/34297956
9,,,,,,,,,3,,közepes állapotú,gázkazán,,,,,,maganszemely,"Érdliget egyik legszebb elhelyezkedésű ingatlanát kínálom tulajdonosként, a Kakukkfű utcában. A 2145 nm-es, óriási fákkal és zöldnövényzettel dúsított telek az utca irányból emelkedik. Masszív, tégla falazatú garázsos, háromszintes, körbejárható ház áll a telek közepén. A 70-es évek végén épült családi ház jelenleg 3 önálló, külön bejáratú lakást foglal magában. Családi fogyasztói közösség szerinti gázfogyasztás alapján kedvező rezsiköltéssel tartható fenn a 7 szobás, 3 fürdőszobás épület. A lejtésnek köszönhetően két lakrész terasz- illetve kertkapcsolatos, a belső kétszintes (a tetőteret is magában foglaló) lakás kisebb erkélye a parkosított előkertre, tágas erkélye a hátsó, épített medencés gondozott kertre néz. Az épület homlokzati szigetelése 2006-ban készült el. A radiátoros fűtés gázkazánról történik, a használati melegvíz ellátás villanybojlerről. (éjszakai áram és 3 fázis van) Az igazán különleges ingatlan több célra is a legjobb választás lehet: bővíthető, igény szerint átala...",,,https://ingatlan.com/34629814
10,,,,,,,,2022,,,újszerű,padlófűtés,,önálló garázs - benne van az árban,,,,bizonytalan,"Eladó panorámás, új építésű igényes ikerházfél Érdliget legszebb utcájában – tulajdonostól 15 percre a MOM parktól! Örök panoráma • Engedélyezett tetőtér-beépítési terv (+ 60 m²) • Dupla garázs • Okosotthon rendszer • 2022-ben épült Ha Ön a nyugalmat, a magas minőséget és a páratlan kilátást keresi, akkor ez az otthon szerelem lesz első látásra! Mindössze 50 méterre az erdei túraútvonaltól, így pár perc alatt a természetben lehet. Érdliget legszebb utcájában, az Alsóvölgyi úton a völgyben kínálunk eladásra egy 2022-ben épült, igényes kivitelezésű, 112 m²-es ikerházfelet 38 m²-es dupla garázzsal és 6 m² tárolóval, többautós feljáróval és Hörmann elektromos személybejárós, ablakos garázskapuval. Helyiségelosztás: Alsó szint: - Dupla garázs (38 m²) - Tároló (6 m²) Földszint: - Amerikai konyhás nappali-étkező - 3 hálószoba - 3 fürdőszoba, ebből az egyik a szülői hálóból nyílik - Előszoba - Közlekedő - Erkély (8 m²) - Terasz (11 m²) Felső szint – beépítésre vár (kb. 60 m²): - 2 hálószoba (k...",,,https://ingatlan.com/34922422
11,,,,,,,,1981 és 2000 között,,,felújított,"gázkazán, hűtő-fűtő klíma",,,,,,maganszemely,"Tágas családi otthon eladó nagy telekkel és sok lehetőséggel! Álmai otthonát keresi? Ez a 1089 m²-es telekre épült, impozáns családi ház Érd legszebb és legkeresetteb részén található,minden igényt kielégít – legyen szó többgenerációs együttélésről, tágas terekről vagy a természet közelségéről. Örök panorámás kilátással. Alapterület és elosztás: Földszint: 126 m² + 30 m²-es nyitott terasz – tökéletes helyszín reggeli kávézáshoz vagy nyári grillpartikhoz -3 kényelmes hálószoba -Tágas nappali extra magas, 3,15 méteres; a földszint többi részén 2,9méteres belmagassággal -Külön konyha, fürdőszoba és WC Tetőtér: 88,5 m² alapterületből 39 m² hasznos lakótér -3 további hálószoba -Fürdőszoba, így az emeleten is teljes a komfort Pince: 106 m² – 2,3 m-es belmagassággal, ideális tárolásra, barkácsoláshoz vagy hobbitérnek, 2 autónak alkalmas garázsrésszel Parkolás és kényelem: Kétállású fedett kocsibeálló, így autói biztonságban és időjárástól védetten állnak Kétszárnyú elektromos kapu Kovácsoltva...",,,https://ingatlan.com/34830633
12,,,,,,,,1950 és 1980 között,,,közepes állapotú,gázkazán,,önálló garázs,,,,maganszemely,"Eladó Érd központjában, Érdliget városrészben a Sajó utca – Szamos utca sarkán található családi ház. Az ingatlan csendes, családias utcában helyezkedik el. A 70-es években épült ház bruttó alapterülete 135,7 m2 (nettó 107,2m2) garázzsal együtt. A ház alatt pince helyezkedik el. A lakótér elrendezése méretekkel a mellékelt alaprajzon található. Az 538 m2-es négyzet alakú saroktelek egyik sarkában fedett szerszámos tároló található. A téglaépítésű, cseréptetős lakóház összkomfortos, műanyag nyílászárókkal rendelkezik, a fűtésről pedig gázkazán gondoskodik. A melegvizet átfolyó rendszerű gázmelegítő biztosítja. Az ingatlan jó állapotú akár azonnal költözhető és tehermentes. Ingatlanközvetítők segítségét nem kérjük!",,,https://ingatlan.com/34818034
13,,,,,,,,2024,,,új építésű,gázkazán,,udvari beálló,,,,ingatlaniroda,"Érdliget szívében, a csendes és felkapott utcájában kínáljuk eladásra ezt az új építésű, modern lakóingatlant, amely ideális választás családosok számára. Az ingatlan nettó lakóterülete 133 nm + 29 nm terasz + 18 nm erkély, + 1 fedett kocsibeálló, míg a telek mérete 500 nm, az árban benne van konyhabútor is. Az öt tágas szobával és két fürdőszobával rendelkező otthon minden igényt kielégít. Érdliget rendkívül kedvelt környék, ahol a természet közelsége és a városi élet előnyei egyaránt megtalálhatók. A környék csendes, biztonságos, ideális a gyermekek neveléséhez. A közeli játszóterek és zöld területek lehetőséget adnak a szabadban való aktív időtöltésre, míg a közeli iskolák és óvodák könnyen elérhetőek, így a családok számára minden fontos intézmény a közelben található. A közlekedési lehetőségek is kiemelkedőek, hiszen a város központja mindössze néhány percnyi autóútra van, ahol számos bolt, étterem és szolgáltatás várja.",,,https://ingatlan.com/34850299
14,,,,,,,,2020,2,,újszerű,"gázkazán, padlófűtés",,önálló garázs - benne van az árban,,,,ingatlaniroda,"KIVÁLÓ INFRASTRUKTÚRÁVAL RENDELKEZŐ PANORÁMÁS, UTCAFRONTI IKERHÁZ! Ez a nem régen épült panorámás kilátással rendelkező IKER-ház KERESI tulajdonosát!! Az ingatlan nettó 135 nm-es, 4+1 fél szobás két fürdővel, szemet gyönyörködtető kerttel, panorámás terasszal, garázs kialakítású! NINCS SZOLGALMI ÚT,UTCFRONTRÓL VAN A BEJÁRAT MINDKÉT HÁZNAK!!! TÖKÉLETES VÁLASZTÁS A NAGYVÁROSOK ZAJÁTÓL TÁVOLI, ENERGIAHATÉKONY ÁLOMOTTHONT KERESŐK SZÁMÁRA! Szeretné meglepni szeretteit vagy biztonságban tudni a pénzét? Akkor ha ön is így gondolja ajánlanám ezt az ingatlant!! JÖJJENEK, NÉZZENEK KÖRÜL, HOGYAN IS ALAKÍTANÁK KI, az amúgy is gyönyörű otthont AZ ÖNÖK IGÉNYEI SZERINT! Kérem hívjon, találkozzunk a helyszínen, hogy körbesétálhassunk a nyugodt , szép környezetben megépült ingatlant, alakítsuk ki együtt az Ön és kedves családja szép új otthonát :) Az ingatlan, magas minőségi anyagok felhasználásával és magas műszaki tartalommal épült. A házat ajánljuk családosoknak, hiszen itt minden az Állam adta kedv...",,,https://ingatlan.com/34915043
15,,,,,,,,,2,,jó állapotú,gázkazán,,udvari beálló,,,,ingatlaniroda,"Eladó kétgenerációs családi ház Érdliget egyik legjobb részén! Kiváló adottságokkal rendelkező, kétszintes, 2 generáció számára is ideális családi ház eladó Érdligeten, csendes, zöldövezeti környezetben! Az ingatlan teljes körű felújításon esett át kb. 10 éve, a fürdőszoba pedig most, 2025-ben lett frissen és igényesen felújítva. A ház kialakítása lehetővé teszi akár két generáció zavartalan együttélését is, de egy család számára is tökéletes választás. Az ingatlanhoz 2 terasz is tartozik •egy árnyékos, kb. 15 m²-es terasz, amely ideális pihenésre, kávézgatásra, olvasásra •valamint egy nagy, 25 m²-es napozóterasz, ahol zavartalanul élvezhető a napsütés A telek mérete ideális, a ház elrendezése jól átgondolt, a környék pedig nyugodt és biztonságos, mégis minden fontos szolgáltatás könnyen elérhető. Főbb jellemzők: •2 szint, szeparálható lakrészek •Teljes körű felújítás 10 éve •Frissen felújított fürdőszoba •2 terasz (árnyékos és napozó) •Csendes, zöld környezet •Kiváló tömegközlekedés é...",,,https://ingatlan.com/34867355
16,,,,,,,,2021,,,új építésű,"hőszivattyú, padlófűtés",,önálló garázs - benne van az árban,,,,ingatlaniroda,"ALACSONY REZSI, PANORÁMA, NAGY NAPPALI, HATALMAS TERASZOK ÉRDLIGETEN! Érdliget csendes mellékutcájában kínálunk megvételre egy igényes kivitelezésű, ALACSONY REZSIJŰ, PANORÁMÁS, HŐSZIVATTYÚS, DUPLAGARÁZSOS, bruttó 210 nm-es (nettó 157 nm), nappali + 4 szobás, tágas amerikai konyhás, ÚJ ÉPÍTÉSŰ ikerházi lakást, a hozzá tartozó 626 nm-es telekkel. CSOK + Évtizedes tapasztalattal és megtekinthető referenciákkal rendelkező, tőkeerős, MEGBÍZHATÓ KIVITELEZŐ! Várható átadás: 2024. I. negyedév Műszaki tartalom: •Az alapban C16-os mixerbeton, a koszorúban és födémben C20-as mixerbeton. Aljzatbeton ESTRICH. •Falazat: 30-as Porotherm tégla. Kívülről 15 cm-es DRYVIT. Felül 25 cm-es kőzetgyapot szigetelés. A válaszfal 10-es válaszfaltégla. Falak kétszer glettelve, fehér színre festve. •Tető: 1. osztályú impregnált faanyag, antracit betoncserép. •Nyílászárók: 3 rétegű, 5 légkamrás, bukó-nyíló, ELEKTROMOS REDŐNNYEL ÉS SZÚNYOGHÁLÓVAL ELLÁTVA. •A ház fűtéséről és melegvíz-ellátásáról HŐSZIVATTYÚ gondos...",,,https://ingatlan.com/34563606
17,,,,,,,,1981 és 2000 között,2,,közepes állapotú,"gázkazán, vegyes tüzelésű kazán",,önálló garázs,,,,maganszemely,"Két generációs, örök panorámás családi ház eladó, Érdliget egyik legszebb helyén, 1180 m2 fás telken. Az ős-fás, teraszosan kialakított ingatlant fenyő- és gyümölcsfa valamint formára vágott sövény borítja. Egy kis veteményesnek is jutott hely. A családi ház : Földszint : 90 m2 Itt 1 szoba, ebédlő, konyha, fürdőszoba+WC, 1 félszoba lett kialakítva, valamint egy műhely, ahol egy vegyes tüzelésű és egy gázkazán biztosítja a fűtést. A használati meleg vizet villanybojler adja, itt található még egy fáskamra is. Első emelet : 90 m2 Két szoba, 1 félszoba, 1 konyha, 1 éléskamra, 1 fürdőszoba, 1 külön WC, 1 tetőtéri feljáró, 1 közlekedő. A szobák külön bejáratúak. Közlekedés : Érd Autóbuszpályaudvartól, 735 Volánbusz 30 perc, 733, 736 Volánbusz 25 perc az ingatlan, személygépkocsival Érd központ 7 perc, M7 autópálya felhajtó személygépkocsival 9 perc. Bevásárlási lehetőségek : InterSpár, Penny Market Bajcsy Zs. út, Lidl Balatoni Felnőtt- és gyerek orvosi ellátás : Háziorvos Riminyáki út és Cs...",,,https://ingatlan.com/34772195
18,,,,,,,,1981 és 2000 között,3,,jó állapotú,gázkazán,,önálló garázs,,,,ingatlaniroda,"Érdligeten, elegáns és csendes környéken, természetvédelmi terület szomszédságában, 2194 nm-es telken fekvő, 1999-ben épült, parkosított kerttel rendelkező, napos, minden igényt kielégítő, szigetelt villaépület. Az ingatlant a tágas és légies terek jellemzik. A szinteket egy kényelmes méretű, világos lépcsőház köti össze. A földszint központi részen egy 80 nm-es, kandallóval rendelkező, teraszkapcsolatos nappali található, melyben egy részben szeparált olvasószekció is kialakításra került. Szomszédságában a tágas, minden igényt kielégítő kert és teraszkapcsolatos, étellifttel szerelt, teljeskörűen gépesített, konyha és az ugyancsak kényelmes méretű étkező kapott helyet. Ezen szinten egy szeparált lakrész is kialakításra került, 24 nm-es hálószobával és egy 20 nm-es, káddal és zuhanyzóval is szerelt fürdővel. A 110 nm-es terasz kényelmes teret biztosít a pihenésre és kikapcsolódásra. Itt található a 4 x12 m-es (1,5m mélységű) medence is. A jól átgondolt kialakítás része egy a medence ha...",,,https://ingatlan.com/34676559
19,,,,,,,,1981 és 2000 között,2,,újszerű,"hűtő-fűtő klíma, elektromos fűtőpanel",,udvari beálló - benne van az árban,,,,maganszemely,"ÉRDLIGET LEGJOBB IKERHÁZA VÁRJA TULAJDONOSAIT!!! AZONNAL KÖLTÖZHETŐ!!!! Megvételre ajánlok Érd központhoz közel,de csendes utcában egy ikerházat! Még mind a két fél elérhető. A netto 100 m2-en három hálószoba,konyha,nappali,fürdő,vendég wc helyezkedik el a következőképpen: Földszint: tágas nappali,melyből a teraszra juthatunk,ahonnan a kertet csodálhatjuk,konyha,wc. Emelet: három hálószoba, kádas fürdőszoba,közlekedő,erkély. Az ingatlan teljesen újszerű.A meleget klímák biztosítják H-tarifás mérővel,valamint három norvég panel segíti a kellemes hőmérséklet elérését. A 30-as téglafalakon 15 cm-es homlokzati szigetelés van,valamint a födémen 30 cm.Betoncserép a tetőfedés. A két lakás között az elválasztó falon mindkét oldalról 5 cm gyapot szigetelés van,plusz akusztikus karton,így a szomszéd teljesen elszeparált. Minimális rezsiköltség... A ház két utcára nyílik,megközelíthető mindkét oldalról. Több kocsival is lehetőség van telken belül parkolni,ahova elektromos kapun keresztül juthatun...",,,https://ingatlan.com/34767074
20,,,,,,,,2012,,,újszerű,,,,,,,bizonytalan,"Exkluzív kaliforniai stílusú villa Érdligeten – 840 m²-es luxuséletérzés, 2000 m²-es telken Eladó egy kivételes, 2012-ben épült, kétszintes luxusvilla Érdliget legszebb részén, több mint 2000 m²-es, parkosított telken. Az ingatlan igazi kuriózum a magyar piacon: kaliforniai stílusú, letisztult és mégis elegáns megoldásaival, pálmafákkal, kültéri fűtött medencével és egy 150 m²-es fedett terasszal. A VILLA FŐBB JELLEMZŐI: 840 m²-es hasznos alapterület 7 méteres belmagasságú reprezentatív előtér, közvetlen kijárattal a kertbe Tágas nappali, konyhaszigetes étkező, prémium konyhával Billiárdszoba, szivarszoba, szauna, gőzkabin, sportszoba Szülői lakosztály a földszinten, saját gardróbbal és fürdőszobával Háztartási helyiség + 4 állásos garázs, közvetlen kamraeléréssel Két emeleti lakosztály nappalival, hálóval, gardróbbal, fürdővel + egy vendégszoba fürdővel KÜLTÉR: 150 m²-es, nagyrészt fedett terasz Fűtött kültéri úszómedence, halastó Kerti konyha és grillező, örökzöldekkel, pálmafákkal s...",,,https://ingatlan.com/34820556
21,,,,,,,,2025,2,,új építésű,"hőszivattyú, padlófűtés",,önálló garázs - benne van az árban,,,,ingatlaniroda,"Érdligeten, egy csendes, aszfaltozott, férfi neves utcában eladó egy 540 m²-es saroktelken épülő, két szintes, nettó 194,1 m²-es önálló családi ház. Az ingatlan 2 nappali + 3 szoba + 3 félszoba + 2 fürdőszoba elosztású, hőszivattyús fűtéssel, garázzsal és három terasszal. A tágas elrendezésnek köszönhetően akár több generációs otthonnak is kiváló választás. Az épület modern technológiai megoldásokkal és prémium minőségű anyagokkal készül, betartva a száradási időket. A ház vasalt, szigetelt beton sávalapra épül, 30-as Porotherm téglából, 10-es vakolt válaszfalakkal és beton födémmel. A homlokzatra 15 cm dryvit szigetelés kerül, a lábazatra 10 cm XPS, az aljzatra 10 cm lépésálló, míg a fa szerkezetű zárófödémre 25 cm kőzetgyapot szigetelés kerül. A tető sötétszürke Terran cserépfedést kap, színezett bádogozással. A fűtést modern hőszivattyú biztosítja padlófűtéssel, amely kedvező rezsiköltségeket garantál. Fehér, műanyag, háromrétegű hő- és hangszigetelt nyílászárók kerülnek beépítésre,...",,,https://ingatlan.com/34767100
