id,cim,reszletes_cim,teljes_ar,reszletes_ar,terulet,nm_ar,szobak,epitesi_ev,szint,allapot,ingatlan_allapota,futes,erkely,parkolas,energetikai,tajolas,kert,hirdeto_tipus,leiras,ingatlanos,telefon,link
43,,,,,,,,2013,,,,"hőszivattyú, mennyezeti hűtés-fűtés",,önálló garázs,,,,bizonytalan,"KIVÉTELES LEHETŐSÉG: ERDŐSZÉLI ÁLOMOTTHON ÉRDLIGETEN ÉRD legszebb és legjobb részén, hangulatos, CSENDES utcában eladó egy minden igényt kielégítő, modern, NAPELEMES, HŐSZIVATTYÚS, OKOS CSALÁDI HÁZ 3 hálószobával, 2 fürdőszobával, gardróbszobával, kandallóval, épített kerti nappalival és gyönyörűen parkosított, ŐSFÁS kerttel! A HÁZRÓL Az 1043 nm telekre épült 177nm hasznos alapterületű, egyszintes, a telken körbejárható, ÚJSZERŰ, ÖNÁLLÓ CSALÁDI HÁZ korszerű technológia és magas minőségű anyagok felhasználásával épült. 2db távolból is irányítható, elektromosan működő kapun lehet gépkocsival behajtani, az egyállásos 20nm-es GARÁZS mellett a térkővel burkolt kocsibeállón akár további 3-4 személyautó is elfér. A kényelmes előszobából szintén megközelíthető a garázs és egy praktikus kamra helyiség, valamint innen nyílik egy vendégmosdó is. Már a házba belépve elénk tárul a ház középpontjában lévő, 3 méter belmagasságú, napfényes, a kertre panorámás, AMERIKAI KONYHÁS, hangulatfényekkel megvi...",,,https://ingatlan.com/34551119
44,,,,,,,,1981 és 2000 között,2,,felújítandó,"gázkazán, vegyes tüzelésű kazán",,önálló garázs - benne van az árban,,,,bizonytalan,"Érdliget-Diósd határánál, aszfaltozott utcában eladó 1092 m2-es telken egy 260 m2-es, 3 szintes, 6 szobás, több generációra alkalmas, felújítandó családi ház, nagy garázzsal. A ház 1989-ben 30-as gázbeton téglából épült, beton födémmel. A tető fedése Bramac betoncserépből készült, a zárófödémhez 15 cm-es üveggyapot szigetelés került. Az ingatlanban az építéskor beépített fa szerkezetű nyílászárók találhatóak. A fűtésről egy régi gázkazán, valamint egy vegyestüzelésű kazán gondoskodik, radiátoros hőleadással, a meleg víz ellátásért egy villany bojler felel. Az ingatlan statikailag jó állapotban van, azonban műszaki és esztétikai felújításra szorul. Több generáció kialakítására is alkalmas, a tetőtér egy külső lépcsőről is elérhető, illetve a pince szinten a nagy méret és a 2 külön bejárat miatt akár 2 lakrész kialakítható. Földszin - 25.8 m2-es nappali, melyből kiléphet egy 24.5 m2-es teraszra, - 16.3 m2-es étkező, - 8 m2-es konyha, - 19.5 m2-es szoba, - 10.3 m2-es szoba, - 7.5 m2-es kö...",,,https://ingatlan.com/34624642
45,,,,,,,,1950 és 1980 között,,,jó állapotú,gázkazán,,udvari beálló,,,,bizonytalan,"Álom családi ház Érd központjában! Készüljön fel a tökéletes családi életre! 90 nm-es összkomfortos ház várja Önöket Érd központjától mindössze 1 km-re. Vonatállomás 5 perc, iskola és óvoda a közelben. Két hálószoba, tágas nappali, konyha-étkező és fürdőszoba várja a családot. A házat körülvevő, ablakokkal ellátott fedett terasz és gondozott kert biztosítja a kellemes időtöltést. Plusz garázs és tároló a telken! Tehermentes, azonnal birtokba vehető! Egy kis festés, és máris költözhet! Ne hagyja ki ezt a lehetőséget! Hívjon most, és egyeztessen látogatást!",,,https://ingatlan.com/34917239
46,,,,,,,,2025,,,,hőszivattyú,,teremgarázs hely - benne van az árban,,,,ingatlaniroda,"ÉRD PARKVÁROSBAN , ÚJONNAN ÉPÜLT LUXUS, 5 szobás, duplakomfortos-2 fürdőszobás – 2 WC -hőszivattyús,- ÖNNÁLLÓ , 129m2-es/ egyszintes CSALÁDI HÁZ 840 m2-es saját kerttel és + 30 m2-es saját GARÁZZSAL , AKÁR AZONNALI KÖLTÖZÉSSEL, 10 %-AL LEKÖTHETŐ ! AZ INGATLAN JELENLEGI KULCSRAKÉSZ ÁLLAPOTBELI ÉRTÉKE, 160 millió 2023.ÉVI ÉRTÉKBECSLÉSSEL KERÜL ALÁTÁMASZTÁSRA, mely a feleknek korrekt útmutatóként szolgál, az esetleges ez évi 3 %-os kamatozású hitelfelvételnél is. A ház önállóan áll , körbejárható, a 840 m2-es telek magas KERÍTÉSSEL van körbekerítve, ELEKTROMOS KAPUVAL ellátva, melyen akár teherautó is be tud állni, a 30 m2-es GARÁZSBAN 2 autónak biztosított a parkolás. Műszaki: főfalak 15 cm dryvit szigeteléssel, thermo nyílászárókkal ellátva, kerámia cseréppel fedésű tető. Teljes műszaki tartalom: A ház 30cm-es hőszigetelt téglából , 15 cm-es Dryvit szigeteléssel, a nyílászárók, korszerű , hő és hangszigetelő fehér műanyagból készülnek 2 rétegű üvegezéssel. Az épület szerkezeti kialakítá...",,,https://ingatlan.com/34882555
47,,,,,,,,1950 és 1980 között,,,jó állapotú,gázkazán,,udvari beálló - benne van az árban,,,,maganszemely,"ÉRDLIGETEN, A SZABADIDŐPARK KÖZELÉBEN, JÓ ÁLLAPOTÚ IKERHÁZFÉL, 443 NM-ES TELEKKEL, FEDETT KOCSIBEÁLLÓVAL ELADÓ! Érdliget csendes, családi házas övezetében kínálunk eladásra egy saroktelken álló 1976-ban épült, később bővítésre került szépen karbantartott ikerházfelet, 443 nm-es saját telekkel. Az ingatlan saját helyrajzi számmal rendelkezik, NEM osztatlan közös tulajdon! A fő épület kb 75 nm-es, elosztásába tartozik egy előszoba (közlekedő), 2 tágas szoba, konyha, étkező, kamra és egy fürdőszoba. 20 évvel ezelőtt hozzáépítésre került téglából egy 18 nm-es helyiség, mely jelenleg hálószobaként és egy zuhanyzós fürdőként funkcionál, illetve 3 évvel ezelőtt egy 24 nm-es könnyűszerkezetes plusz tér is kialakításra került, melyből könnyen akár két szoba is kialakítható. Az évek során, szakemberek által több felújítási és karbantartási munkát végeztek az ingatlanon. ( Pl. Burkolatcsere, fürdőszoba felújítás, festés, mázolás, víz-, villany vezeték részleges csere, kerítés, kapu stb) A fűtést ...",,,https://ingatlan.com/33549259
48,,,,,,,,1950 és 1980 között,2,,felújítandó,gázkazán,,,,,,maganszemely,"Eladó családi ház Érdliget Budapesthez közeli részén, felújításra váró lehetőségekkel! Főbb jellemzők: •Telek mérete: 439 nm •Lakóterület: bruttó 120 nm (nettó 106 nm), tetőtér-beépítéses •Építés éve: földszint 1969-ben épült, felújítandó állapotú •Felújítások: 2018-ban betoncserép fedésű új tető kialakítása, a tetőtér beépítése és új fűtésrendszer kialakítása az egész házban megtörtént. Fűtés és nyílászárók: •A fűtést és a meleg vizet egy új Ariston gázcirkó biztosítja, amely hatékony és energiatakarékos megoldás •A földszinten régi fa ablakok, míg a tetőtérben műanyag nyílászárók kerültek beépítésre Tetőtér: •A tetőtérben a szobák burkolása, valamint a fürdőszoba és WC kialakítása az új tulajdonosra vár Elosztás: •Földszint: előszoba, nappali, hálószoba, fürdőszoba és konyha •Tetőtér: 3 szoba, fürdőszoba és külön WC, melyek kialakítása az új tulajdonos feladata Elhelyezkedés: •Bevásárlási lehetőségek: ALDI, Tesco és egyéb vásárlási lehetőségek 10-15 perces sétára találhatók •Városköz...",,,https://ingatlan.com/34398014
49,,,,,,,,2001 és 2010 között,2,,újszerű,gázkazán,,,,,,maganszemely,"Eladó egy igazán különleges otthon Érd csendes, zöldövezeti részén – tulajdonostól Ha egy olyan otthont keresel, ahol a tágas terek, a gondos tervezés, és a természetközeli nyugalom találkozik a modern kényelmi megoldásokkal, akkor ezt a házat látnod kell! Ez a 138 nm-es, két szintes családi ház 2000-ben épült, azóta is egy kézben van – a tulajdonos szeretettel és odafigyeléssel gondoskodott róla az évek során. A belső elrendezés átgondolt, élhető: Alsó szint: Nappali, étkező és konyha – egy légtérben, mégis jól elkülönülve Szülői hálószoba Zuhanyzós fürdőszoba Első és hátsó bejárat előszobákkal Háztartási és gépészeti helyiség Belső tároló Parkoló helyiség Felső szint: 2 különálló hálószoba Külön gardróbhelyiség Tágas, kádas fürdőszoba Amitől ez az otthon még különlegesebb: Gáz cirkó fűtés: radiátorok és padlófűtés kombinációja – energiatakarékos és komfortos Nagy, fedett-nyitott terasz: tökéletes helyszín családi és baráti összejövetelekhez Ápolt, parkosított kert automata öntözőrend...",,,https://ingatlan.com/34838602
50,,,,,,,,2001 és 2010 között,2,,jó állapotú,gázkazán,,önálló garázs,,,,maganszemely,"Tágas családi ház Érdliget szívében – akár két generációnak is ideális! Álmod egy nyugodt, mégis kiváló elhelyezkedésű otthonról Érden? Akkor ez az ingatlan neked szól! Eladó egy remek állapotú, 2000-ben épült, önálló családi ház Érdliget csendes, barátságos lakóövezetében. A ház egy 557 m²-es telken helyezkedik el, és nettó 177 m² hasznos alapterületet kínál – tökéletes akár két generáció együttélésére is! A földszinten egy hangulatos, tágas átriumos nappali található konyhával, valamint előszoba, hálószoba, külön WC és fürdőszoba. A nappaliból elektromos redőnnyel felszerelt, nagy teraszajtó vezet a kertbe. Az autót sem kell kint hagyni: a garázs egyállásos, elektromos kapuval. Az emeletre érve lenyűgöző tér fogad: a galériáról belátható a nappali, ahol közel 6 méteres belmagasság uralja a teret. Ezen a szinten található egy második nappali konyhával, három hálószoba és egy fürdőszoba is. A melegvíz-ellátás itt éjszakai árammal működő villanybojlerrel, míg a földszinten kombi gázkazá...",,,https://ingatlan.com/34820813
51,,,,,,,,,,,,"hőszivattyú, padlófűtés, hűtő-fűtő klíma",,,A++,,,maganszemely,"Érdliget egyik legkedveltebb utcájában, 538 m2-es, teljes közművel ellátott, széles utcafrontos telekre épülő, bruttó 155 m2-es, nappali + 3 hálószobás családi ház, dupla garázzsal ELADÓ! Az új építésű, minden igényt kielégítő családi ház, magas színvonalon, a mai kor igényeinek megfelelően, a korszerű technológiákkal és minőségi anyagokból készül. A letisztult stílusú otthon, akár több gyermekes család számára is maximális kényelmet nyújt. A nettó 127 m2 lakótér nagyon kellemes, praktikus elosztású, két lakótérre osztott. A közös használatú helységektől a jól elszeparált, személyes térben lévő hálószobák biztosítják a nyugalmas pihenést. A lakótérben: 30 m2-es nappali - konyha - étkező, 3 hálószoba, fürdőszoba - toalettel, és a háztartási helyiség-toalett található. Alul, egy 30 m2-es garázs valamint egy 11 m2-es tárolóként feltüntetett szoba, amely előtt egy zuhanyzó is helyet kaphat. A nappaliból nyíló 15 m2-es, részben fedett terasz és az ottani páratlan kilátás teszi felejthetetle...",,,https://ingatlan.com/34824422
52,,,,,,,,1981 és 2000 között,2,,jó állapotú,"gázkazán, vegyes tüzelésű kazán, hűtő-fűtő klíma",,udvari beálló - benne van az árban,,,,bizonytalan,"Napfényes, tetőtérbeépítéses családi ház Érden – kiváló közlekedéssel, Budapest közelében! Eladó egy gondosan karbantartott, folyamatosan megújított, 132 nm-es (nettó) családi ház, 696 nm-es telekkel, dupla kocsibeállóval, melléképületekkel. Érd egyik csendes utcájában, rendezett szomszédsággal, kiváló tömegközlekedési és autós kapcsolatokkal. A ház 1981-ben épült, de az elmúlt évek során jelentős felújításokon esett át, így műszakilag és esztétikailag is remek állapotban van. Helyiségek elosztása: Földszint – kb. 92 m²: Előszoba Nappali 2 külön nyíló szoba Konyha + tágas kamra Fürdőszoba (épített zuhannyal) Külön WC Tetőtér – nettó kb. 40 m²: Közlekedő Konyha Hálószoba erkéllyel Fürdőszoba (káddal) Tároló Szuterén: 42 m² pince 2 helyiséggel – sokféle tárolási vagy hobbi célra Fölötte fedett terasz, ideális a nyári pihenésekhez Kert és külső adottságok: Virágoskert, tujákkal körbevett hátsókert 2 autó számára fedett beálló Melléképületek tárolásra Gerard cserepes lemez tetőfedés Külső ...",,,https://ingatlan.com/34852971
53,,,,,,,,2024,,,,"hőszivattyú, padlófűtés",,önálló garázs,A+,,,ingatlaniroda,"Érdligeten, a nyugalom szigetén, új építésű 4 hálószobás nettó 198nm-es családi ház eladó. Az ingatlan tágas, napos, jó elosztású és intim, szép környezetben, panorámás kilátással. A házban 4 nagy hálószoba, egy amerikai konyhás , teraszkapcsolatos nappali, (50nm) számos tároló helyiség, két fürdőszoba, 3 WC, egy dupla garázs kapott helyet. Hőszivattyús fűtési rendszer, vizes rendszerű padlófűtéssel. Választható burkolatok, szaniterek, beltéri ajtók. Burkolatvalasztás után költözhető!",,,https://ingatlan.com/34545433
54,,,,,,,,1981 és 2000 között,2,,jó állapotú,"gázkazán, padlófűtés",,önálló garázs - benne van az árban,,,,maganszemely,"Csak irodánk kínálatában! Érdligeten, madárcsicsergős környezetben, kiváló állapotú családi ház, dupla garázzsal, rendezett kerttel ELADÓ. Elrendezése nagyon praktikus, a földszinti lakrészt 3 külön bejáratról is megközelíthetjük. Az utca front felől egy 6m2-es erkélyen keresztül jutunk be a nappaliba, ház oldalán pedig egy másik bejárat, amely az előszobába vezet, innét a konyhán keresztül egy privát szférájú, fedett teraszra jutunk ki, amely a varázslatos kertel is kapcsolatos, de külön bejáratként is használhatjuk, mivel a ház oldalát körbefogja az előszobai bejáratig. Földszinten található egy tágas 24m2-es nappali, 12 m2 közlekedő, egy nagyon praktikus, tolójatós 9m2-es gardrób, 2 szoba(16m2 és 9m2)plusz egy 5m2-es félszoba, amely jelenleg bár szobaként van kialakitva, továbbá konyha+étkező 12m2, külön WC 1.5m2 WC, fürdőszoba +bidé 4m2 + előtér 1.5m2. Emeleten kapott helyet: Közlekedő, fürdőszoba +WC, 2 szoba, panorámás erkély, és 2 tároló. Ennek a szintnek a HASZNOS lakóterülete ...",,,https://ingatlan.com/34709892
55,,,,,,,,1950 és 1980 között,,,közepes állapotú,elektromos fűtőpanel,,,,,,maganszemely,"Érd Ligeten eladó! Aszfaltozott utcában. 100 nm es 2 szoba ,nappali , konyha , étkezős különálló iker ház 400 nm es saját telekkel,teraszokkal. A közelben található vasút és buszmegálló kiváló közlekedési kapcsolatokat biztosítanak, lehetővé téve a gyors és egyszerű eljutást a város bármely pontjára. Ezen felül a környék gazdag szolgáltatásokban és szabadidős tevékenységekben, így sosem lesz gond a bevásárlással vagy a szórakozással. Érdemes megtekintenie! ÁR:52.9M",,,https://ingatlan.com/34789205
56,,,,,,,,1950 és 1980 között,,,közepes állapotú,gáz (konvektor),,udvari beálló,,,,maganszemely,"Eladó 2 szobás családi ház Érdligeten, kis méretű telekkel! A Rekreációs park közelében helyezkedik el Egy szintes, 64 m²-es, önálló téglaépítésű ház, cserépfedésű tetővel Helyiségei: 2 szoba, konyha étkezővel, fürdőszoba, előszoba, folyosó és egy kis terasz Átlagos állapotban van, azonnal költözhető, alacsony fenntartási költségekkel Saroktelken található, a telek mérete 412 m² Gázkonvektoros fűtés, kandallóval mint alternatív fűtési lehetőséggel Két nagyobb méretű tároló is rendelkezésre áll Fa nyílászárók redőnnyel ellátva Éjszakai áram is be van vezetve A telken belül 1-2 autó számára van beállási lehetőség, illetve a ház előtt is biztosított a parkolás Előnyben részesítjük a készpénzes érdeklődőket A tulajdonosok nyitottak, rugalmasak A környék barátságos, kedves szomszédokkal KIVÁLÓ LEHETŐSÉG PÁROKNAK, ILLETVE EGYEDÜLÁLLÓKNAK, AKIK NYUGODT, HANGULATOS KÖRNYEZETBEN SZERETNÉNEK SAJÁT OTTHONT TEREMTENI! Most jött el az ideje, hogy álmait valóra váltsa! Ne habozzon, hívjon mielőbb, m...",,,https://ingatlan.com/34823138
57,,,,,,,,2001 és 2010 között,3,,felújított,"gázkazán, vegyes tüzelésű kazán",,teremgarázs hely,,,,maganszemely,"Egy különleges, igazán egyedi otthonra vágyik? Megtalálta! Óriási terek, elegancia, luxus jellemzi ezt a fantasztikus hangulatú 2002-ben épült, minden igényt kielégítő otthont! A ház Érd elit részén található, ahol a szomszédos házak távol helyezkednek el egymástól, ahol természetközeli a környezet, csend van és nyugalom, az utcák aszfaltozottak és kiváló az infrastruktúra is! A Szép Házak című folyóiratban is megjelent ház magas minőségű anyagokból épült, de tulajdonosai azóta is nagy gondot fordítanak az állagmegóvásra, valamint a folyamatos korszerűsítésekre. A lakóterülete 230 m2, ezen felül tartozik hozzá egy 130 m2-es félszuterén, ahol helyet kapott a kétállásos garázs is! Mindezt egy 2266 nm területű, gyönyörűen ápolt, parkosított birtok veszi körül. A nappaliban található gyönyörű kandalló, a tömörfa konyhabútor valamint a különleges, egyedi nyílászárók a ház egyediségét tükrözik. Belső helyiségei tágasak, otthonosak, itt az elegancia mellett a legélhetőbb tereket sikerült megv...",,,https://ingatlan.com/34712496
58,,,,,,,,1981 és 2000 között,2,,felújítandó,"gázkazán, vegyes tüzelésű kazán",,önálló garázs - benne van az árban,,,,ingatlaniroda,"ELADÓ CSALÁDI HÁZ SAROKTELKEN ÉRDLIGETEN! Tökéletes választás mindazok számára, akik KERTVÁROSI KÖRNYEZETBEN, kiváló ELÉRHETŐSÉGGEL rendelkező otthont keresnek! Ebben a rendezett és kulturált lakókörnyezetben egy belső kétszintes, 130 nm-es, összközműves CSALÁDI HÁZ várja új tulajdonosát. A 642 négyzetméteres telken elhelyezkedő ingatlan remek lehetőségeket rejt magában. Az ingatlan földszintje összesen 88 négyzetméternyi lakóteret biztosít. Itt található a TÁGAS nappali (18,4 nm), egy KÉNYELMES méretű hálószoba (15,5 nm), valamint egy világos, ablakos konyha (8 nm), Ideális méretű társalgó/hall (14 nm) szintén ezen a szinten helyezkedik el. Emellett a földszinten fürdőszoba(5,5 nm) és külön wc is kialakításra került, megkönnyítve a mindennapokat. Az EMELET – a beépített tetőtér – közel 50 négyzetméteres területet foglal magában. Itt három további szoba és egy befejezetlen állapotú fürdőszoba található. Valamint egy 8 nm-es tetőtéri/padlástér rész, amely jelenleg tárolásra alkalmas, ám...",,,https://ingatlan.com/34615171
59,,,,,,,,2001 és 2010 között,2,,jó állapotú,gázkazán,,önálló garázs - benne van az árban,,,,ingatlaniroda,"Eladó családi ház Érden, az Érdliget csendes övezetében! Egy kiváló állapotú, 2000-ben épült, önálló családi házat kínálunk eladásra Érd Érdliget részén, egy csendes, családi házas környezetben. Az ingatlan egy 557 m²-es telken fekszik, és 177 m²-es nettó hasznos alapterülettel büszkélkedhet. A földszinten egy tágas, hangulatos, átriumos nappali található konyhával, egy előszoba, egy hálószoba, egy wc és egy fürdőszoba. A nappalihoz tartozik egy nagy teraszajtó, amely elektromos redőnnyel van felszerelve. A garázs egy autónak ad helyet, elektromos ajtóval ellátva. Az emeleten egy galéria található, ahonnan letekintve a nappalira, körülbelül 6 méteres belmagassággal. Itt továbbá egy másik tágas nappali konyhával, három hálószoba és egy fürdőszoba helyezkedik el. Az emeleti melegvíz-ellátást egy éjszakai áramról működtethető villanybojler biztosítja, míg a földszinti melegvíz-szolgáltatást egy kombi gázkazán látja el. A ház Porotherm 30-as téglából készült, hőszigetelő nemesvakolattal, a...",,,https://ingatlan.com/34317856
60,,,,,,,,2025,,,,"hőszivattyú, padlófűtés",,önálló garázs - benne van az árban,,,,maganszemely,"ÉRDLIGET LEGSZEBB RÉSZÉN, PANORÁMÁS TELKEN, ÚJÉPÍTÉSŰ CSALÁDI HÁZ ELADÓ! Kiváló lokáció, magas szintű kivitelezés! Érdligeten, csendes, aszfaltozott utcában, igényes házak környezetében eladó egy újépítésű, 150m2-es, nappali + 3 hálószobás, garázsos, fedett teraszos, önálló családi ház. A projekt nyár végén indul, várható átadás 2025. év vége. A házhoz tartozó telek területe 538m2, önálló helyrajzi számon. A családi ház falazata 30-as Porotherm tégla lesz, 15 cm-es EPS szigeteléssel, a műanyag nyílászárók 3 rétegű, 6 légkamrás üvegezéssel lesznek ellátva. Modern, hőszivattyús fűtésrendszer, padlófűtéssel, a tetőn cserépfedés kerül megvalósításra. ""H"" tarifa előkészítéssel, 3,5 KW klímával kerül a ház átadásra. Egyéb extraként a bádog nemcsak a hagyományos horgonyzott színben, hanem a cseréppel azonos színben is kérhető. A belső burkolatok, ajtók választhatóak, de a projekt jelen szakaszában még a belső elosztás végső kialakításába is beleszólhat az új tulajdonos! A tervek alapján a csa...",,,https://ingatlan.com/34825157
61,,,,,,,,,2,,,"hőszivattyú, padlófűtés",,önálló garázs - benne van az árban,,,,bizonytalan,"KÉT GYÖNYÖRŰ, PANORÁMÁS ÚJ ÉPÍTÉSŰ IKERLAKÁS ELADÓ ÉRDLIGET CSENDES UTCÁJÁBAN, SAJÁT TELEKKEL 90%-OS KÉSZÜLTSÉG, ÁTADÁS ADÁSVÉTELTŐL SZÁMÍTOTT EGY HÓNAP! Érdliget csendes mellékutcájában kínálunk megvételre egy igényes kivitelezésű, ALACSONY REZSIJŰ, PANORÁMÁS, HŐSZIVATTYÚS, DUPLAGARÁZSOS, bruttó 210 nm-es (nettó 157 nm), nappali + 4 szobás, tágas amerikai konyhás, ÚJ ÉPÍTÉSŰ ikerházi lakást, a hozzá tartozó 637 nm-es telekkel. Műszaki tartalom: •Az alapban C16-os mixerbeton, a koszorúban és födémben C20-as mixerbeton. Aljzatbeton ESTRICH. •Falazat: 30-as Porotherm tégla. Kívülről 15 cm-es DRYVIT. Felül 25 cm-es kőzetgyapot szigetelés. A válaszfal 10-es válaszfaltégla. Falak kétszer glettelve, fehér színre festve. •Tető: 1. osztályú impregnált faanyag, antracit betoncserép. •Nyílászárók: 3 rétegű, 5 légkamrás, bukó-nyíló, redőnnyel és szúnyoghálóval ellátva •A ház fűtéséről és melegvíz-ellátásáról HŐSZIVATTYÚ gondoskodik, a hőleadás padlófűtésen keresztül történik. •H-Tarifa •Választha...",,,https://ingatlan.com/34687528
62,,,,,,,,2001 és 2010 között,3,,újszerű,"gázkazán, padlófűtés",,önálló garázs,,,,maganszemely,"Egy különleges, igazán egyedi otthonra vágyik? Megtalálta! Óriási terek, elegancia, luxus jellemzi ezt a fantasztikus hangulatú 2002-ben épült, minden igényt kielégítő otthont! A ház Érd elit részén található, ahol a szomszédos házak távol helyezkednek el egymástól, ahol természetközeli a környezet, csend van és nyugalom, az utcák aszfaltozottak és kiváló az infrastruktúra is! A Szép Házak című folyóiratban is megjelent ház magas minőségű anyagokból épült, de tulajdonosai azóta is nagy gondot fordítanak az állagmegóvásra, valamint a folyamatos korszerűsítésekre. A lakóterülete 230 m2, ezen felül tartozik hozzá egy 130 m2-es félszuterén, ahol helyet kapott a kétállásos garázs is! Mindezt egy 2266 nm területű, gyönyörűen ápolt, parkosított birtok veszi körül. A nappaliban található gyönyörű kandalló, a tömörfa konyhabútor valamint a különleges, egyedi nyílászárók a ház egyediségét tükrözik. Belső helyiségei tágasak, otthonosak, itt az elegancia mellett a legélhetőbb tereket sikerült megv...",,,https://ingatlan.com/34794178
63,,,,,,,,2024,3,,,"hőszivattyú, padlófűtés, hűtő-fűtő klíma",,önálló garázs,,,,maganszemely,"ÉRDLIGETEN EGY RENDKÍVÜLI ADOTTSÁGÚ, RITKA SZÉP PANORÁMÁS, TÖBB GENERÁCIÓS CSALÁDI HÁZ ELADÓ! AKIK MÉG SZERETNÉK MEGÉPÍTENI AZ ÁLOMHÁZUKAT, AZOKNAK EZ A PROJEKT REMEK LEHETŐSÉG. AKÁR BEFEKTETŐKNEK IS AJÁNLOTT. A környezet. Csendes és aszfaltozott utca. Teljes közműves telek, fás, és zöld környezet, könnyű közlekedéssel a főút 2 percre kocsival, de a buszjárat is könnyen elérhető távolságra van. Az épület: Terveket a jelenlegi tulajdonos egy neves építésszel közösen tervezte. De ettől el lehet térni még saját igényeknek megfelelően. A ház fotói a jelenlegi állapotot is mutatja. Nagyon ritka az a kialakítás és panoráma ami több helységből is látható nem csak a nappaliból. Alapvetően itt csak a telek értéke 45 millió Ft átlagosan. A ház jelenleg szerkezetkész állapot előtt tart. Minden részletre kiterjedő domumentációt rendelkezésre bocsátunk az érdeklődők részére. Néhány fontos paraméter: Nappali : 35 nm, konyha-étkező: 39 nm Hálószobák minimum 15-17-20 nm-esek, a fürdők , szintenként 14...",,,https://ingatlan.com/34197855
