id,cim,reszletes_cim,teljes_ar,reszletes_ar,terulet,nm_ar,szobak,epitesi_ev,szint,allapot,ingatlan_allapota,futes,erkely,parkolas,energetikai,tajolas,kert,hirdeto_tipus,leiras,ingatlanos,telefon,link
85,,,,,,,,1950 és 1980 között,,,felújított,"hűtő-fűtő klíma, elektromos fűtőpanel, vegyes tüzelésű kazán",,önálló garázs - benne van az árban,,,,ingatlaniroda,"Eladó napfényes családi ház Érdligeten 116 m², 805 m²-es telken Ár: 140 500 000 Ft Érdliget csendes, jól megközelíthető részén kínálunk eladásra egy 116 m²-es, téglaépítésű családi házat, 805 m²-es, gondozott telekkel. Az ingatlan kiváló műszaki állapotban van, számos korszerűsítéssel! Ház jellemzői: Téglaépítésű, 20 cm homlokzati szigetelés + szigetelt lábazat Betonfödém, a födém szigetelés megrendelve Tető: tartós cserepeslemez Új villanyóra, 3x20 Amper, H tarifa Hűtő-fűtő klíma, fürdőszobai falimelegítő Vegyestüzelésű kazán Konyhabútor és az előszobabútor a vételárban Telek és külső adottságok: 805 m²-es napfényes kert Térkövezett beálló egészen a garázsig 37 m2-es garázs ipari árammal és szerelőaknával, 16 m2-es pince Szaletli, termő gyümölcsfák, ásott kút Az ingatlan ideális választás lehet családosoknak, de azok számára is, akik egy jól felszerelt, stabil szerkezetű, energiahatékony otthont keresnek. Ne maradjon le róla jöjjön el, nézze meg, szeressen bele!",,,https://ingatlan.com/34801392
86,,,,,,,,1981 és 2000 között,2,,felújított,gázkazán,,udvari beálló - benne van az árban,,,,ingatlaniroda,"ÚJ IRODÁT KERES VÁLLALKOZÁSÁNAK? Megvételre kínálok egy 240 m2 alapterületű, 5 szobás, két szintes, ingatlant mely kiváló lehetőségeket rejt magában. Az ingatlan elrendezése a következőképpen alakul: FÖLDSZINT: Földszinten található egy 28 m2-es “open office” iroda, melyben 7 munkaállomás kapott helyet, valamint két tárgyaló (9,6 m2-es és 8,3 m2-es), egy teakonyha és egy 31 m2-es műhely, mely igény szerint alakítható, berendezhető. Igény szerint amerikai konyhás nappalivá alakítható. Ez a helyiség a korábbi években - mielőtt az irodai kialakítás megtörtént - is funkcionált hasonlóképpen. EMELET: Az emelet egy jól szeparált lépcsőházból közelíthető meg. Az emeleten kialakításra került egy nappali - szoba - gardrób - konyha - étkező elrendezésű lakás. Az ingatlan elhelyezkedéséből és elosztásából fakadóan könnyen bérbeadható. TELEK: Az udvarban helyett kapott egy kis halastó, grillező, kétállásos fedett gépkocsibeálló és 5 db parkoló is. Az ingatlan fűtését egy gázkazán biztosítja. A mel...",,,https://ingatlan.com/34145570
87,,,,,,,,1981 és 2000 között,,,felújítandó,"vegyes tüzelésű kazán, gázkazán",,önálló garázs,,,,bizonytalan,"Érden 3 szobás tégla családi ház eladó! Jellemzője: -téglából épült, sávalapra, vízszigeteléssel; -betonfödémmel rendelkezik; -tetőszerkezet jó, héjazat cserére érett; -67 m2-es ház, 2+1 szoba kialakítással; -a ház állapota felújítandó; -nincs repedés, süllyedés, vizesedés; -fűtése radiátorokkal, vegyes tüzelésű és gázkazánnal; -melléképületek 23,7 m2 és 17 m2-es garázs. Bevásárló központ, vasútállomás 600 méterre! Ára: 65 Millió Ft Érdeklődni: Kardos Marianna",,,https://ingatlan.com/34736149
88,,,,,,,,2001 és 2010 között,3,,felújított,gázkazán,,önálló garázs - benne van az árban,,,,ingatlaniroda,"Tisztelt Érdeklődő! Magánszemély tulajdonosként értékesítjük Érdliget legszebb-legjobb helyén a Tulipán utcában található családi házunkat! A lokáció:A ház Budapesttől 15-18km-re található,nyugodt,csendes utcában,igényes luxus ingatlanok szomszédságában.A telek szinte sík,de mivel a dombtetőn helyezkedik el,csodás örök körpanoráma tárul elénk Budapestre,és a környező településekre.Néhány száz méteres körzetben található nívós iskola,gimnázium,vadonat új bölcsőde-óvoda,buszmegálló,Spar szupermarket,és a most épülő Lidl. Az épület:A ház 667nm-es telken,30-as téglából épült,8-cm-es szigeteléssel,teljesen új takarékos kondenzációs kazánnal radiátor,és padlófűtéssel,műanyag nyílászárókkal,és kétrétegű üvegekkel rendelkezik.A szobák laminált parkettával a többi helyiség járólappal burkoltak. Az elosztás:A családi ház 3 szintes,összesen 157nm,a szuterénben kazánház,mosókonyha,és egy szabadidő szoba található.A földszinten nappali+1szoba,konyha-spájz,fürdőszoba wc-vel kapott helyet.A legfelső ...",,,https://ingatlan.com/34089384
89,,,,,,,,1981 és 2000 között,2,,felújított,gázkazán,,önálló garázs - benne van az árban,,,,ingatlaniroda,"ELADÓ CSALÁDI HÁZ ÉRDLIGET BUJA ZÖLD, ŐSFÁS KÖRNYEZETÉBEN, TÖBBSZINTES BEÉPÍTETT TERASZOS MEGOLDÁSOKKAL, PÁRATLAN ÖRÖKPANORÁMÁVAL – Egy hely, ahol az otthon és a természet találkozikÉrdliget „Rózsadombján”, exkluzív, mégis természetközeli, csendes részén, Diósdliget határában vár új tulajdonosára ez az energiatakarékos, világos, panorámás családi ház. A 143 m²-es, könnyűszerkezetes, nappali+2 szobás (+1 szoba, mert a jelenleg gardrób 10 nm-es, ablakos, így szobaként is funkcionálhat) ingatlan 635 m²-es telken helyezkedik el, ahonnan páratlan panoráma tárul elénk.A ház praktikus beosztású, minden részletében gondosan tervezett, délkeleti fekvésének köszönhetően egész nap napfényes. Az alsó szinten tágas, teraszkapcsolatos nappali, teraszkapcsolatos étkező-konyha, kamra, gardróbszoba, fürdőszoba és különálló WC található. Az emeleten két kényelmes hálószoba és egy tároló kapott helyet. A pince szinten további két, fűthető helyiség – mosókonyha-tároló, kazánhelyiség, és akár edzőteremként...",,,https://ingatlan.com/34798711
90,,,,,,,,2021,2,,újszerű,hőszivattyú,,önálló garázs,,,,maganszemely,"KIZÁRÓLAG A CASA NETWORK BUDA KÍNÁLATÁBAN! 2023.július 15.-től költözhető! ALACSONY REZSIKÖLTSÉGGEL üzemeltethető! Érdliget, Diósdhoz közeli, közkedvelt családi házas részén, megvételre kínálok egy Tarnay Tünde építész-tervező által tervezett magas minőségben kivitelezett klasszikusan elegáns, stílusos vonalvezetésű családi villát. Az ingatlan kivételes prémium kategóriát képviselő, saját részre épült családi otthon. Érd város legszebb házának 3. helyezettjének díját vehette át. A 2021- ben épült ház egy 1094 m2-es telken helyezkedik el. Az ingatlan elé érkezve lenyűgöző látvány tárul elénk, impozáns oszlopok, előkert, egyedi építészeti megoldások ,melyek igazán egyedi megjelenésűvé teszik ezt a csodaszép villát. A ház az utcához képest úgy került megtervezésre, hogy legyen egy belső intim udvara, amely lakói nyugodt pihenését szolgálja. Fűtött alapterülete: 266,53 m2 Teraszokkal növelt alapterület: 353 m2 A kétszintes ház tágas előterébe egy 10 m2-es boltíves belépőn keresztül érkezün...",,,https://ingatlan.com/33288505
91,,,,,,,,1950 előtt,,,felújítandó,"gáz (konvektor), cserépkályha",,udvari beálló - benne van az árban,,,,ingatlaniroda,"Eladó egy sok lehetőséget kínáló ingatlan Érdligeten, nyugodt, csendes, főútközeli utcában. (jelenleg hagyatéki eljárás van folyamatban, vételi ajánlat tehető rá) A telek területe 1355 nm, enyhén lejtős. Kerekes kút található rajta. A ház a telek középső részén helyezkedik el, ezáltal kellemes távolságban van az utcafronttól, és az enyhe lejtés miatt a kilátás is biztosított. 116 nm alapterületű, pár lépcső vezet fel a bejárati ajtóig, amin keresztül az előtér/étkezőbe juthatunk. Jobb oldalon egy tárolóhelyiség található, majd egy kis oldalfolyosó vezet egy nagyobb, ablakos fürdőszobába, mely a hálószobához tartozik. Erről is kis folyosóról nyílik a pincelejárat. A pince két helyiségből áll, száraz, ablakos. Bal oldalon a bejárati ajtó mögött egy szeparált külön wc (ablakos) található, majd a cselédszoba/gardrobe, utána a konyha nyílik, amihez tágas kamra tartozik. Mindkettő ablakos. Az étkezőből szemben nyílik a nappali szoba, ami sarokablakokkal néz a kertre, valamint innen léphetünk...",,,https://ingatlan.com/34899939
92,,,,,,,,2001 és 2010 között,2,,jó állapotú,"gázkazán, kandalló",,udvari beálló - benne van az árban,,,,maganszemely,"EZ NEM „TUCAT HÁZ”! MODERN KOMFORT a KÖZÉPKOR STÍLUSÁBAN! KERESÜK a HÁZ ÚJ ÚRÁT, ÚRHÖLGYÉT és APRÓDOKAT! Az ingatlan belső stílusa minden helyiség apró kiegészítőjében harmonizál a belső homlokzat alap koncepciójával. A ház Érdliget kerületében, a virágneves utcák között, 1122 m2-es birtokon fekszik. 2004-ben építették (bővítették) újjá. Összesen 132 m2 + 40 m2 tégla melléképület. Hasznos lakóterülete 113 m2. 3 szoba + nappalis összkomfortos épület. A földszinti része 58 m2 + ~15 fedett terasz. Előszoba, 1 szoba + nappali, konyha-étkező és a felső szintre vezető lépcső található itt. Az emeleten 55 m2-en a „bálteremből” nyílóan 2 hálószoba (jobb és bal szárnyon), 2 gardrób a kelméknek (az egyik zuhanyzóvá is átalakítható) és egy loggia került kialakításra. A kellemes belső hőmérsékletről és komfortos tisztálkodásról Baxi típusú kombi cirkó gondoskodik radiátor hőleadással. A nappaliban a hangulat teljeségéhez nélkülözhetetlen kandalló is megtalálható (vízteres, nem csak helyben melegít...",,,https://ingatlan.com/34380178
93,,,,,,,,1981 és 2000 között,2,,jó állapotú,gázkazán,,,,,,ingatlaniroda,"Érdligeti családi ház akár két generációnak is! Eladó családi ház Érden, Érdliget csendes övezetében! Eladásra kínálunk egy remek állapotban lévő, 2000-ben épült, önálló családi házat Érd Érdliget részén, csendes, családi házas környezetben. Az ingatlan 557 m²-es telken helyezkedik el, és nettó 177 m² hasznos alapterülettel rendelkezik. A ház földszintjén található egy tágas és hangulatos átriumos nappali konyhával, valamint egy előszoba, egy hálószoba, egy wc és egy fürdőszoba. A nappali nagy teraszajtaja elektromos redőnnyel van felszerelve. A garázs egy autó beállására alkalmas, és szintén elektromos ajtóval rendelkezik. Az emeleti szintre felérve a galériáról lenézhetünk a nappalira. Ezen a szinten található még egy nagy nappali konyhával, három hálószoba és egy fürdőszoba is. A fenti szint melegvíz ellátását egy villanybojler biztosítja, amely éjszakai áramról üzemeltethető, míg a földszinten a kombi gázkazán látja el a melegvíz szolgáltatást. A ház Porotherm 30-as téglából épült,...",,,https://ingatlan.com/34342447
94,,,,,,,,1950 előtt,,,felújítandó,gáz (konvektor),,,,,,bizonytalan,"1940-es években épült 2 soros válaszfal téglából, masszív alápincézett, felújításra szoruló ház. Kerekeskúttal.",,,https://ingatlan.com/34762993
95,,,,,,,,2020,2,,újszerű,"padlófűtés, gázkazán, hűtő-fűtő klíma",,udvari beálló - benne van az árban,C,,,bizonytalan,"Belső kétszintes családi házunk csendes aszfaltozott zsákutcában található. A közelben van a Papi földek, játszótér, Tesco, Penny, Aldi, Lidl, két vasútállomás, buszmegálló, óvoda, általános iskola, posta, orvosi rendelő, mind sétatávolságra elérhető. A bruttó 162 m2-es (nettó 130) földszinten található 3 szoba, nappali-étkező, konyha, kamra, mosókonyha, 2 db WC, zuhanyzó, fürdőszoba, előszoba, folyosó, tároló, valamint a nappaliból nyílik a belső lépcsőház és egy nagy félig fedett hátsó terasz +(elkezdett külső tároló). A szobákban laminált parketta van, a többi helyiség járólapos. Az emeletre betonlépcső vezet. Az emelet kb. nettó 73 m2 és jelenleg kb. 80%-os készültségű (a 3 szobában laminált parketta van, a többi helyiség járólapos lesz). A ház alkalmas lehet két generáció együttélésére vagy akár külön lakrész is kialakítható egy külső feljáró építésével. Az emeleten: nappali/nagyszoba, szoba, gardrób, fürdőszoba, WC és dolgozószoba/konyha, valamint tárolóhelységek találhatóak. A t...",,,https://ingatlan.com/34281657
96,,,,,,,,,2,,,"gázkazán, vegyes tüzelésű kazán",,önálló garázs,E,,,maganszemely,"Érdligeten eladó felújítandó családi ház, a Papi Földek Városliget mellett! Az ingatlan kertvárosi nyugalmas környezetben található. Az érdligeti vasútállomástól gyalogosan 15 percre, autóval 5 percre. Sétára pedig az érdi Városliget található. A kert 553nm. A ház 97nm+36nm garázs. Garázs szerelőaknával ellátott, illetve wc és zuhanyzó is ki lett alakítva. A házba innen is nyílik bejárat. A házon 5cm-es hungarocell szigetelés van. 1970-es évek végén épült téglából.A tulajdonos építtette. Belső kétszintes. Az alsó szinten előszobából konyhába és a szobába jutunk.A szobából lehet az emeletre feljutni. A ház alapjaiban jó,lakható,de felújítást illetve modernizálást igényel. Fűtése gázkazán és vegyes tüzelésű kazánnal megoldott. Ház -szoba 4 -félszoba 1 -fürdőszoba -wc 3 -előszoba Környék Nyugalmas,családias.A sétára lévő ligeti szabadidőpark kiváló kikapcsolódást nyújt mindenkinek. Ajánlom olyan családoknak akik igazi kertvárosi élere vágynak! Ha kiváncsi jöjjön tekintse meg! Adatbázisunk...",,,https://ingatlan.com/34910337
97,,,,,,,,2025,2,,,"hőszivattyú, padlófűtés",,önálló garázs - benne van az árban,A+,,,ingatlaniroda,"Érdligeten Diósd határában Érd kiemelt környezetében olajfa telep szomszédságában( ősfás , zöldövezetes , panorámás területen ) eladó egy 538 m2-es önálló telken egy újépítésű, nettó 140 m2-es 4 szoba nappalis, duplagarázsos ,14 m2-3es fedett, oldalról nyitott ( nyugati fekvésű ) terasszal ellátott igényesen kivitelezett újépítésű családi ház. Az ingatlan Cég által kivitelezett , minden kedvezményes hitel felvehető rá! Önálló , hőszivattyús fűtésrendszerrel ellátott, EXTRA környezetben, ÚJÉPÍTÉSŰ CSALÁDI HÁZ!! Rövid műszaki ismertető: Vasalt C20 beton alap, zsalukő lábazat, 30 N+F kerámia tégla falazat, 10 N+F kerámia válaszfalazat, fafödém, tűz gátló anyaggal kezelt tetőgerendák, antracit Terrán betoncserép. A kivitelező nagy hangsúlyt fektet a lehető legjobb hőszigetelésre: a 30 as N+F falazatra 15 cm es , , a lábazaton 10 cm es xps szigetelés, az aljzatban 10 cm es lépésálló szigetelés található. A födémet 30cm es kőzet gyapotszigetelést fedi. A nyílászárók 5 légkamrás profilú műany...",,,https://ingatlan.com/34928025
98,,,,,,,,1950 és 1980 között,,,közepes állapotú,gáz (konvektor),,,,,,maganszemely,"Eladó 2 szobás családi ház Érdligeten – alacsony rezsi, remek elhelyezkedés Érdliget egyik csendes, barátságos részén, a Rekreációs park közelében kínálunk megvételre egy egyszintes, 64 m²-es, önálló családi házat. Az ingatlan saroktelken, 412 m²-en helyezkedik el, és ideális lehet mindazok számára, akik elérhető árú, saját kerttel rendelkező otthont keresnek. Főbb jellemzők: -2 különnyíló szoba -Konyha + étkező, fürdőszoba, előszoba, folyosó -Kis terasz a bejáratnál – tökéletes reggeli kávézáshoz -Alacsony fenntartási költségek, beköltözhető állapot -Téglaház, cseréptetővel Műszaki adatok: -Fűtés: gázkonvektor + alternatív fűtésként kandalló -Nyílászárók: fa ablakok redőnnyel -Éjszakai áram rendelkezésre áll -2 db nagy méretű tároló a kertben Parkolási lehetőség: -1-2 autó beállása megoldható a telken belül -Utcai parkolás lehetséges További előnyök: -Motivált tulajdonosok, rugalmas egyeztetés -Barátságos, segítőkész szomszédság Ez az ingatlan ideális választás lehet első otthonnak, i...",,,https://ingatlan.com/34904764
99,,,,,,,,1981 és 2000 között,2,,felújítandó,"gázkazán, vegyes tüzelésű kazán",,udvari beálló - benne van az árban,,,,maganszemely,"KÉREM INGATLANOSOK NE ZAVARJANAK!Hétvégén érdeklődjenek telefonon mert hétköznap nem alkalmas ,vonatkozik ez a személyes megtekintésre is!!!Az eladó ház 132 m² alapterületű — ebből a hasznos terület 101 m² és sarok telken fekszik. 1974-ben épült, 1986-ban épült a tetőtér.Gyér forgalmú aszfaltozott utcában. Felújítandó, lakható állapotú.Az ingatlant főleg energetikailag és esztétikailag kell felújítani! Jelenleg lakott. Földszinten: konyha, kamra, külön wc, fürdőszoba, előszoba, +2 szoba, lépcsőház. Emeleten lomtár, előszoba, fürdőszoba+wc, +3 szoba. Gáz- és vegyestüzelésű a fűtési rendszer, fali radiátorokkal és nyitott gravitációs tágulási tartállyal. A meleg vizet mindegyik szintre 1 villanybojler biztosítja. Részlegesen alápincézett 41 m²-en. A telek területén különálló nyeregtetős gazdasági épület(felújítandó) a másik utcáról bejárati kapuval. Az ingatlanhoz még egy különálló kicsi boros pince is tartozik. A kertben gyümölcsfák és szőlő is található. Az ingatlant esztétikailag és h...",,,https://ingatlan.com/34901492
100,,,,,,,,1950 és 1980 között,2,,felújítandó,gázkazán,,önálló garázs - benne van az árban,,,,ingatlaniroda,"*** Ingatlanközvetítők kérem ne keressenek, kizárólagosan megbízott ingatlanközvetítő vagyok ! *** ÉRDLIGET keresett KERTVÁROSI környezetében az Árvalányhaj utcában, családi ház nagy teleken eladó. A telek 1160 m2-es (17 m x 68 m), összközműves, víz, gáz, villany bevezetve. A telken lévő ház gyenge minőségű, körben szigetelt. A ház alatt pince is található, a tetőtér nem beépített. Az építési besorolás Lke-1/h, kertvárosi lakóövezeti, szabadonálló beépítési mód, 25 %-os beépíthetőséggel, max. 6 m homlokzati magassággal, egylakásos egység építhető. Az utcáról külön gyalogos és külön gépkocsibejáró is vezet a telekre, saját 16 m2-es garázs van a telken. RITKA LEHETŐSÉG, KIVÉTELESEN jó helyen ! Csendes ZÖLD környezet, nagy KERT, kiváló INFRASTRUKTÚRA !! ( Kérésre további fotókat és teljeskörű bemutató videót szívesen küldök. )",,,https://ingatlan.com/34896793
101,,,,,,,,2024,,,újszerű,hűtő-fűtő klíma,,"utca, közterület - ingyenes",,,,maganszemely,"Újszerű, hőszigetelt, 2+2 szobás, napfényes házrész eladó Érdligeten, kertkapcsolattal, külön bejárattal – azonnal költözhető! 2024-ben teljeskörűen újjáépített és korszerűsített tégla építésű házrész eladó, kiváló műszaki és esztétikai állapotban! A 15 cm grafit szigeteléssel ellátott épület csendes, napfényes környezetben helyezkedik el, ingyenes parkolással az utcán, kizárólagos tulajdonban. A legfontosabb tudnivalók: - Hasznos alapterület: 55 m² (hivatalos: 46 m²) - 2+2 szoba, világos terek, napfényes nyugati tájolás - 15 m²-es saját terasz, kertre néző kilátással - Szigetelés: 15 cm grafitos rendszer - Fűtés & hűtés: hűtő-fűtő klíma - Extra felszereltség: szauna, kandalló, riasztó, légkondi - Korszerűsítve 2024-ben: új vezetékek, vízszigetelés, épületbővítés (Ytong + Porotherm) - Beépített konyhabútor, bútorozottan eladó - Kerékpártároló, kiváló internetkapcsolat (Yettel) - 1/1 tulajdon, nincs közös költség - Lakás jelenleg nem lakott – azonnal birtokba vehető! - A vasútállomás 8-...",,,https://ingatlan.com/34882478
102,,,,,,,,1950 és 1980 között,,,felújítandó,házközponti,,udvari beálló,,,,maganszemely,"Magánszemélytől ELADÓ Egy 1/1 tulajdonú Érd egyik legszebb részèn, Èrdliget tetejèn a Gyöngyvirág utcában található 85 nm2 családi ház, egy ritkaságnak számító 1133 nm2-es telken, örök panorámával. A ház felújítandó és bővíthető, 25 % beèpíthető, maximum 6 méter homlokzati magasságig. Pár kilométeren belül több iskola és óvoda is található. Ha szeretne egy csodás nyugodt otthont egy nem túlzsúfolt, csendes környéken ez az ingatlan lehet az ideális választás. Irány ár : 79,9 M Ft. Ingatlantosok segítségét, köszönöm nem kérem!",,,https://ingatlan.com/34870462
103,,,,,,,,2025,2,,,"hőszivattyú, padlófűtés",,,,,,ingatlaniroda,"ÖNÁLLÓ CSALÁDI HÁZ, SZÉLES UTCAFRONTTAL,DUPLA GARÁZZSAL, KIVÁLÓ KÖZLEKEDÉSSEL, ÉRD-LIGET SZÍVÉBEN! Ajánlom figyelmébe, ezt az önálló családi házat,ami bruttó 150 nm-es, nettó 127 nm-es! Dupla garázzsal, 3 szoba , nappali-étkező, konyha egy légtérben, garázs szinten még egy nagy szoba, ami az alaprajzon tárolóként van feltüntetve, akár egy fürdő is kialakítható mellette! Ezen kívül van még egy gépészeti helyiség is! Exkluzív otthonra vágyik, ahol a luxus, kényelem és nyugalom találkozik? Ne keressen tovább! TÖKÉLETES VÁLASZTÁS A NAGYVÁROSOK ZAJÁTÓL TÁVOLI, ENERGIAHATÉKONY ÁLOMOTTHONT KERESŐK SZÁMÁRA! Az energiahatékonyság jegyében HŐSZIVATTYÚ rendszert alkalmazunk, mely nagyon ENERGIATAKARÉKOS FELHASZNÁLÁST tesz lehetővé. Olyan kertes házra vágyik,melynek párja nincs a környéken és csak a bőröndöt kell begurítania? Akkor ne keressen tovább Megtalálta! A kivitelező törekszik arra,hogy magas minőségű,egyedi kivitelezésű ingatlant alkosson ezen a nem mindennapi környéken!! A ház – csakúgy,...",,,https://ingatlan.com/34847438
104,,,,,,,,,,,,,,,,,,maganszemely,"Érden ligeti részen a vasútállomástól egy sarokra, aszfaltozott utcában, lakható állapotú családi ház tulajdonostól eladó. A ház 75 m2 alapterületű, ami további 25 m2-es beépített üveges terasszal bővített. A 150 négyszögölös telken továbbá található egy 30 m2-es melléképület, mely garázsnak, kis háznak, nyári konyhának egyaránt használható. Udvaron belül ásott kút is található. Parkolni udvaron belül vagy utcafronton lehetséges. Tömegközlekedséssel is jól megközelíthető. A környék zöldövezeti, csendes és biztonságos; bevásárlóközpont, óvoda, iskola közel-, gyalogtávolságban van. Érdeklődés kizárólag telefonon lehetséges.",,,https://ingatlan.com/34842511
105,,,,,,,,1950 és 1980 között,3,,jó állapotú,gázkazán,,önálló garázs - benne van az árban,,,,ingatlaniroda,"Többgenerációs családi otthon Érdliget csendes részén Eladó Érdliget egyik legkedveltebb, nyugodt utcájában egy több generáció számára is ideális, kiváló állapotú több szintes, 9 szobás, kb 300 nm-es, családi ház, 700 nm-es, teraszos kialakítású telken! Az ingatlan három, kellemes, világos, közös lépcsőházból nyíló külön bejáratú lakrészt tartalmaz, összesen 3 nappalival és 6 hálószobával, így ideális többgenerációs együttéléshez, munkahely és élettér szétválasztására, vendégek fogadásához vagy vállalkozáshoz is. Az épület lépcsőn megközelíthető. A lakrészek adatai: Alsó szint: nappali + 2 hálószoba Középső szint: nappali + 2 hálószoba Felső szint (tetőtér): nappali + 2 hálószoba Padlástér (~40 nm): világítóablakos, beépíthető – további lakótérként is hasznosítható Belső elrendezés részletesen Alsó szint: Tágas előtér 2 hálószoba (egy gardróbbal) Nappali + konyha + kamra Fürdőszoba Kazánház és mosókonyha, innen kijárat a műhelybe (4 × 2,5 m) Középső szint: Előtér 2 hálószoba Külön WC é...",,,https://ingatlan.com/34841502
106,,,,,,,,1981 és 2000 között,,,közepes állapotú,gázkazán,,udvari beálló,,,,bizonytalan,"Érdnek legjobb részén Érdligeten eladó egy 67nm -s családi ház ami sok további bővítési lehetőséget kínál. A telek mérete 726nm amiben bőven van még beépíthetőségi lehetőség. A jelenlegi épület bővíthető vagy beépíthető a jelenlegi tetőtér vagy akár egy emelet is húzható rá. A kert végén van még egy kiszolgáló épület is amit szintén igények szerint alakítható (lakrész v. garázs számára) Tágas és szebályos kert a gépkocsikban vagy akár medencének is. Az ingatlan a 80-s évek elején épült, szilárd alapokra, nem igényel semmiféle beavatkozást. A nyílászárók 80%-a már ki lettek cserélve. Telken belül megtaláható az összes közmű. Közlekedés és lokáció szempontjából a lehető legjobb helyen található, az utca aszfaltozott.",,,https://ingatlan.com/34838598
107,,,,,,,,,,,,,,,,,,maganszemely,"Eladó Érd központjában, Érdliget városrészben a Sajó utca – Szamos utca sarkán található családi ház. Az ingatlan csendes, családias utcában helyezkedik el. A 70-es években épült ház bruttó alapterülete 135,7 m2 (nettó 107,2m2) garázzsal együtt. A ház alatt pince helyezkedik el. A lakótér elrendezése méretekkel a mellékelt alaprajzon található. Az 538 m2-es négyzet alakú saroktelek egyik sarkában fedett szerszámos tároló található. A téglaépítésű, cseréptetős lakóház összkomfortos, műanyag nyílászárókkal rendelkezik, a fűtésről pedig gázkazán gondoskodik. A melegvizet átfolyó rendszerű gázmelegítő biztosítja. Az ingatlan jó állapotú akár azonnal költözhető és tehermentes. Ingatlanközvetítők segítségét nem kérjük!",,,https://ingatlan.com/34817293
